Symbol,Name,Last Sale,Net Change,% Change,Market Cap,Country,IPO Year,Volume,Sector,Industry
AACG,ATA Creativity Global American Depositary Shares,$2.47,-0.05,-1.984%,78048512.00,China,2008,33432,Consumer Discretionary,Service to the Health Industry
AACI,Armada Acquisition Corp. I Common Stock,$9.90,-0.01,-0.101%,205024050.00,United States,2021,1668,Industrials,Consumer Electronics/Appliances
AACIU,Armada Acquisition Corp. I Unit,$9.91,0.00,0.00%,0.00,United States,2021,230,Industrials,Consumer Electronics/Appliances
AACIW,Armada Acquisition Corp. I Warrant,$0.21,0.0603,40.281%,0.00,United States,2021,227,Industrials,Consumer Electronics/Appliances
AADI,Aadi Bioscience Inc. Common Stock,$13.19,-0.34,-2.513%,276224624.00,United States,,158679,Health Care,Biotechnology: Pharmaceutical Preparations
AAL,American Airlines Group Inc. Common Stock,$13.74,-0.68,-4.716%,8928883037.00,United States,,23129484,Consumer Discretionary,Air Freight/Delivery Services
AAME,Atlantic American Corporation Common Stock,$3.07,0.0098,0.32%,62638978.00,United States,,9006,Finance,Life Insurance
AAOI,Applied Optoelectronics Inc. Common Stock,$2.56,-0.20,-7.246%,70743250.00,United States,2013,211068,Technology,Semiconductors
AAON,AAON Inc. Common Stock,$59.00,-1.99,-3.263%,3131199502.00,United States,,117225,Industrials,Industrial Machinery/Components
AAPL,Apple Inc. Common Stock,$163.62,-6.41,-3.77%,2836735570800.00,United States,1980,78816237,Technology,Computer Manufacturing
AATC,Autoscope Technologies Corporation Common Stock,$5.29,0.14,2.718%,28520972.00,United States,,45810,Industrials,Industrial Machinery/Components
AAWW,Atlas Air Worldwide Holdings NEW Common Stock,$99.87,-0.03,-0.03%,2815373151.00,United States,,1048560,Consumer Discretionary,Transportation Services
ABCB,Ameris Bancorp Common Stock,$48.26,-1.09,-2.209%,3350970695.00,United States,1994,200820,Finance,Major Banks
ABCL,AbCellera Biologics Inc. Common Shares,$11.26,-0.92,-7.553%,3203877747.00,Canada,2020,1813445,,
ABCM,Abcam plc American Depositary Shares,$15.24,-0.26,-1.677%,3489465675.00,United Kingdom,2020,218368,Health Care,Biotechnology: Biological Products (No Diagnostic Substances)
ABEO,Abeona Therapeutics Inc. Common Stock,$4.08,-0.43,-9.534%,23964843.00,United States,,71535,Health Care,Biotechnology: Pharmaceutical Preparations
ABGI,ABG Acquisition Corp. I Class A Ordinary Shares,$9.88,0.00,0.00%,191005594.00,United States,2021,238,Finance,Business Services
ABIO,ARCA biopharma Inc. Common Stock,$2.36,0.02,0.855%,34007937.00,United States,,40575,Health Care,Biotechnology: In Vitro & In Vivo Diagnostic Substances
ABMD,ABIOMED Inc. Common Stock,$258.12,-16.33,-5.95%,11776928657.00,United States,,290448,Health Care,Medical/Dental Instruments
ABNB,Airbnb Inc. Class A Common Stock,$112.82,-4.21,-3.597%,67285735970.00,United States,2020,3776323,Consumer Discretionary,Hotels/Resorts
ABOS,Acumen Pharmaceuticals Inc. Common Stock,$5.49,-0.04,-0.723%,222351906.00,United States,2021,25001,Health Care,Biotechnology: Pharmaceutical Preparations
ABSI,Absci Corporation Common Stock,$4.18,-0.18,-4.128%,388121494.00,United States,2021,342332,Health Care,Biotechnology: Pharmaceutical Preparations
ABST,Absolute Software Corporation Common Stock,$12.06,-0.21,-1.711%,615522284.00,Canada,2020,98649,,
ABTX,Allegiance Bancshares Inc. Common Stock,$43.69,-0.51,-1.154%,890317179.00,United States,2015,52122,Finance,Major Banks
ABUS,Arbutus Biopharma Corporation Common Stock,$2.28,-0.03,-1.299%,339100380.00,Canada,,801192,,
ABVC,ABVC BioPharma Inc. Common Stock,$0.841,0.0236,2.887%,27170464.00,United States,,47193,Health Care,Biotechnology: Pharmaceutical Preparations
ACAB,Atlantic Coastal Acquisition Corp. II Class A Common Stock,$10.00,0.00,0.00%,300000000.00,United States,2022,2,Industrials,Consumer Electronics/Appliances
ACABU,Atlantic Coastal Acquisition Corp. II Unit,$10.05,0.00,0.00%,0.00,United States,2022,1,Industrials,Consumer Electronics/Appliances
ACABW,Atlantic Coastal Acquisition Corp. II Warrant,$0.085,0.00,0.00%,0.00,United States,2022,5,Industrials,Consumer Electronics/Appliances
ACAC,Acri Capital Acquisition Corporation Class A Common Stock,$10.00,0.00,0.00%,,United States,2022,82,Industrials,Consumer Electronics/Appliances
ACACU,Acri Capital Acquisition Corporation Unit,$10.00,0.00,0.00%,0.00,United States,2022,10,Industrials,Consumer Electronics/Appliances
ACACW,Acri Capital Acquisition Corporation Warrant,$0.075,0.00,0.00%,,United States,2022,1,Industrials,Consumer Electronics/Appliances
ACAD,ACADIA Pharmaceuticals Inc. Common Stock,$16.53,-0.31,-1.841%,2668427321.00,United States,1985,1669352,Health Care,Biotechnology: Pharmaceutical Preparations
ACAH,Atlantic Coastal Acquisition Corp. Class A Common Stock,$9.82,0.00,0.00%,423487500.00,United States,2021,1201,Industrials,Consumer Electronics/Appliances
ACAHU,Atlantic Coastal Acquisition Corp. Unit,$9.8541,0.0441,0.45%,0.00,United States,2021,2900,Industrials,Consumer Electronics/Appliances
ACAHW,Atlantic Coastal Acquisition Corp. Warrant,$0.04,-0.0001,-0.249%,0.00,United States,2021,19366,Industrials,Consumer Electronics/Appliances
ACAX,Alset Capital Acquisition Corp. Class A Common Stock,$9.90,-0.02,-0.202%,111424500.00,United States,2022,9493,Industrials,Consumer Electronics/Appliances
ACAXR,Alset Capital Acquisition Corp. Right,$0.06,0.00,0.00%,0.00,United States,2022,99,Industrials,Consumer Electronics/Appliances
ACB,Aurora Cannabis Inc. Common Shares,$1.54,-0.16,-9.412%,458529727.00,Canada,,9301587,,
ACBA,Ace Global Business Acquisition Limited Ordinary Shares,$10.40,0.00,0.00%,62961600.00,Hong Kong,2021,5005,Finance,Business Services
ACBAW,Ace Global Business Acquisition Limited Warrant,$0.04,0.0001,0.251%,0.00,Hong Kong,2021,408,Finance,Business Services
ACCD,Accolade Inc. Common Stock,$10.81,-1.06,-8.93%,769774003.00,United States,2020,559235,Technology,Interactive Media
ACER,Acer Therapeutics Inc. Common Stock (DE),$1.51,0.005,0.332%,23556000.00,United States,,49374,Health Care,Biotechnology: Biological Products (No Diagnostic Substances)
ACET,Adicet Bio Inc. Common Stock ,$14.35,-0.68,-4.524%,281114032.00,United States,2018,444022,Health Care,Biotechnology: Pharmaceutical Preparations
ACEV,ACE Convergence Acquisition Corp. Class A Ordinary Shares,$10.17,0.00,0.00%,141894657.00,United States,2020,8227,Technology,Semiconductors
ACEVU,ACE Convergence Acquisition Corp. Unit,$10.1843,0.0943,0.935%,0.00,United States,2020,949,Technology,Semiconductors
ACEVW,ACE Convergence Acquisition Corp. Warrant,$0.1051,-0.0031,-2.865%,0.00,United States,2020,22428,Technology,Semiconductors
ACGL,Arch Capital Group Ltd. Common Stock,$46.50,-0.79,-1.671%,17467799168.00,Bermuda,,609966,Finance,Property-Casualty Insurers
ACGLN,Arch Capital Group Ltd. Depositary Shares each Representing a 1/1000th Interest in a 4.550% Non-Cumulative Preferred Share Series G,$19.05,-0.09,-0.47%,0.00,Bermuda,,239356,Finance,Property-Casualty Insurers
ACGLO,Arch Capital Group Ltd. Depositary Shares Each Representing 1/1000th Interest in a Share of 5.45% Non-Cumulative Preferred Shares Series F,$22.895,0.0698,0.306%,0.00,Bermuda,,24711,Finance,Property-Casualty Insurers
ACHC,Acadia Healthcare Company Inc. Common Stock,$82.64,-2.59,-3.039%,7481125331.00,United States,,783370,Health Care,Hospital/Nursing Management
ACHL,Achilles Therapeutics plc American Depositary Shares,$3.10,-0.14,-4.321%,126390153.00,United Kingdom,2021,27046,Health Care,Biotechnology: Biological Products (No Diagnostic Substances)
ACHV,Achieve Life Sciences Inc. Common Shares,$4.70,0.00,0.00%,45504719.00,United States,,71238,Health Care,Biotechnology: In Vitro & In Vivo Diagnostic Substances
ACIU,AC Immune SA Common Stock,$3.18,-0.04,-1.242%,265254924.00,Switzerland,2016,48430,Health Care,Biotechnology: Pharmaceutical Preparations
ACIW,ACI Worldwide Inc. Common Stock,$24.12,-0.71,-2.859%,2768651900.00,United States,,548043,Technology,EDP Services
ACKIT,Ackrell SPAC Partners I Co. Subunits,$10.3701,0.0101,0.097%,0.00,United States,2021,18814,Industrials,Consumer Electronics/Appliances
ACKIU,Ackrell SPAC Partners I Co. Units,$10.38,0.06,0.581%,0.00,United States,2020,748,Industrials,Consumer Electronics/Appliances
ACKIW,Ackrell SPAC Partners I Co. Warrants,$0.03,-0.0099,-24.812%,0.00,United States,2021,32920,Industrials,Consumer Electronics/Appliances
ACLS,Axcelis Technologies Inc. Common Stock,$72.29,-9.44,-11.55%,2387046162.00,United States,2000,1639205,Technology,Industrial Machinery/Components
ACLX,Arcellx Inc. Common Stock,$16.74,-0.93,-5.263%,732987416.00,United States,2022,170453,Health Care,Biotechnology: Pharmaceutical Preparations
ACMR,ACM Research Inc. Class A Common Stock,$17.27,-0.71,-3.949%,1021718501.00,United States,2017,1408766,Technology,Industrial Machinery/Components
ACNB,ACNB Corporation Common Stock,$35.38,-0.67,-1.859%,308054651.00,United States,,9219,Finance,Major Banks
ACNT,Ascent Industries Co. Common Stock,$17.51,0.21,1.214%,,United States,,9671,Industrials,Steel/Iron Ore
ACON,Aclarion Inc. Common Stock,$1.06,-0.185,-14.859%,8290806.00,United States,2022,367457,Technology,Retail: Computer Software & Peripheral Equipment
ACONW,Aclarion Inc. Warrant,$0.40,0.0514,14.745%,0.00,United States,2022,2295,Technology,Retail: Computer Software & Peripheral Equipment
ACOR,Acorda Therapeutics Inc. Common Stock,$0.4278,-0.0172,-3.865%,10386023.00,United States,2006,68081,Health Care,Biotechnology: Biological Products (No Diagnostic Substances)
ACQR,Independence Holdings Corp. Class A Ordinary Share,$9.86,0.005,0.051%,611207941.00,United States,2021,83102,Finance,Business Services
ACQRU,Independence Holdings Corp. Units,$9.88,0.01,0.101%,0.00,United States,2021,5421,Finance,Business Services
ACQRW,Independence Holdings Corp. Warrant,$0.175,0.00,0.00%,0.00,United States,2021,11260,Finance,Business Services
ACRS,Aclaris Therapeutics Inc. Common Stock,$16.46,-1.76,-9.66%,1095938123.00,United States,2015,338954,Health Care,Biotechnology: Commercial Physical & Biological Resarch
ACRX,AcelRx Pharmaceuticals Inc. Common Stock,$0.2945,-0.0163,-5.245%,43325701.00,United States,2011,1099014,Consumer Discretionary,Specialty Chemicals
ACST,Acasti Pharma Inc. Class A Common Stock,$0.90,0.0114,1.283%,39995782.00,Canada,,35377,,
ACT,Enact Holdings Inc. Common Stock,$26.16,-0.30,-1.134%,4259952449.00,United States,2021,94882,Finance,Specialty Insurers
ACTG,Acacia Research Corporation (Acacia Tech) Common Stock,$4.60,-0.16,-3.361%,210724827.00,United States,,153782,Miscellaneous,Multi-Sector Companies
ACVA,ACV Auctions Inc. Class A Common Stock,$8.39,-0.44,-4.983%,1319883749.00,United States,2021,865440,Industrials,Metal Fabrications
ACXP,Acurx Pharmaceuticals Inc. Common Stock,$3.42,-0.14,-3.933%,35100151.00,United States,2021,17470,Health Care,Biotechnology: Pharmaceutical Preparations
ADAG,Adagene Inc. American Depositary Shares,$1.41,-0.06,-4.082%,61749650.00,China,2021,62533,Health Care,Biotechnology: Pharmaceutical Preparations
ADAL,Anthemis Digital Acquisitions I Corp Class A Ordinary Shares,$10.04,0.00,0.00%,303082500.00,United States,2021,20,,
ADALU,Anthemis Digital Acquisitions I Corp Unit,$10.11,0.01,0.099%,0.00,United States,2021,2885,,
ADALW,Anthemis Digital Acquisitions I Corp Warrant,$0.1999,0.00,0.00%,0.00,United States,2021,1,,
ADAP,Adaptimmune Therapeutics plc American Depositary Shares,$2.09,-0.13,-5.856%,338620120.00,United Kingdom,2015,225588,Health Care,Biotechnology: Biological Products (No Diagnostic Substances)
ADBE,Adobe Inc. Common Stock,$381.02,-22.91,-5.672%,178317360000.00,United States,1986,3598698,Technology,Computer Software: Prepackaged Software
ADER,26 Capital Acquisition Corp. Class A Common Stock,$9.87,-0.01,-0.101%,339281250.00,United States,2021,982353,Industrials,Consumer Electronics/Appliances
ADERW,26 Capital Acquisition Corp. Warrant,$0.251,0.00,0.00%,0.00,United States,2021,240,Industrials,Consumer Electronics/Appliances
ADES,Advanced Emissions Solutions Inc. Common Stock,$4.03,-0.04,-0.983%,76957755.00,United States,,101026,Industrials,Industrial Specialties
ADGI,Adagio Therapeutics Inc. Common Stock,$4.59,-0.08,-1.713%,503707394.00,United States,2021,373939,Health Care,Biotechnology: Pharmaceutical Preparations
ADI,Analog Devices Inc. Common Stock,$158.67,-8.40,-5.028%,82477622463.00,United States,,4238316,Technology,Semiconductors
ADIL,Adial Pharmaceuticals Inc Common Stock,$0.5752,0.0002,0.035%,14756159.00,United States,2018,211330,Health Care,Biotechnology: Pharmaceutical Preparations
ADILW,Adial Pharmaceuticals Inc Warrant,$0.0524,-0.0056,-9.655%,0.00,United States,2018,6060,Health Care,Biotechnology: Pharmaceutical Preparations
ADMA,ADMA Biologics Inc Common Stock,$2.70,0.02,0.746%,530150198.00,United States,,2166617,Health Care,Biotechnology: Pharmaceutical Preparations
ADMP,Adamis Pharmaceuticals Corporation Common Stock,$0.3253,-0.0139,-4.098%,48789556.00,United States,,361480,Health Care,Biotechnology: Pharmaceutical Preparations
ADN,Advent Technologies Holdings Inc. Class A Common Stock,$2.72,-0.17,-5.882%,55591926.00,United States,2018,354491,Utilities,Power Generation
ADNWW,Advent Technologies Holdings Inc. Warrant,$0.57,0.0051,0.903%,0.00,United States,2018,19287,Utilities,Power Generation
ADOC,Edoc Acquisition Corp. Class A Ordinary Share,$10.25,0.00,0.00%,56141731.00,United States,2020,51,Finance,Business Services
ADOCR,Edoc Acquisition Corp. Right,$0.08,0.00,0.00%,0.00,United States,2020,22,Health Care,Biotechnology: Biological Products (No Diagnostic Substances)
ADOCW,Edoc Acquisition Corp. Warrant,$0.03,-0.0048,-13.793%,0.00,United States,2020,1834,Finance,Business Services
ADP,Automatic Data Processing Inc. Common Stock,$250.48,-7.73,-2.994%,104637306633.00,United States,,1718777,Consumer Discretionary,Business Services
ADPT,Adaptive Biotechnologies Corporation Common Stock,$10.48,-0.72,-6.429%,1490548937.00,United States,2019,1080199,Health Care,Biotechnology: Biological Products (No Diagnostic Substances)
ADSE,ADS-TEC ENERGY PLC Ordinary Shares,$7.8548,-0.2352,-2.907%,383376277.00,Ireland,,5492,,
ADSEW,ADS-TEC ENERGY PLC Warrant,$0.9803,-0.1197,-10.882%,0.00,Ireland,,6811,,
ADSK,Autodesk Inc. Common Stock,$207.77,-12.38,-5.623%,45142646033.00,United States,,1875923,Technology,Computer Software: Prepackaged Software
ADTH,AdTheorent Holding Company Inc. Common Stock,$3.05,-0.35,-10.294%,261519182.00,United States,2021,278201,Consumer Discretionary,Advertising
ADTHW,AdTheorent Holding Company Inc. Warrants,$0.2928,-0.0372,-11.273%,0.00,United States,2021,2502,Consumer Discretionary,Advertising
ADTN,ADTRAN Holdings Inc. Common Stock,$24.34,-0.13,-0.531%,1881890985.00,United States,1994,564317,Telecommunications,Telecommunications Equipment
ADTX,Aditxt Inc. Common Stock,$0.1581,-0.008,-4.816%,7071155.00,United States,2020,1579069,Consumer Discretionary,Specialty Chemicals
ADUS,Addus HomeCare Corporation Common Stock,$89.99,-3.57,-3.816%,1446266006.00,United States,2009,60040,Health Care,Medical/Nursing Services
ADV,Advantage Solutions Inc. Class A Common Stock,$3.85,-0.15,-3.75%,1225874392.00,United States,2019,210718,Consumer Discretionary,Advertising
ADVM,Adverum Biotechnologies Inc. Common Stock,$1.17,-0.02,-1.681%,115561308.00,United States,2014,1255767,Health Care,Biotechnology: Pharmaceutical Preparations
ADVWW,Advantage Solutions Inc. Warrant,$0.3799,-0.01,-2.565%,0.00,United States,2019,874,Consumer Discretionary,Advertising
ADXN,Addex Therapeutics Ltd American Depositary Shares,$1.15,-0.07,-5.738%,7261703.00,Switzerland,,105383,Health Care,Biotechnology: Pharmaceutical Preparations
AEAC,Authentic Equity Acquisition Corp. Class A ordinary share,$9.90,0.01,0.101%,297000000.00,United States,2021,453134,Finance,Business Services
AEACU,Authentic Equity Acquisition Corp. Unit,$9.92,0.005,0.05%,0.00,United States,2021,199,Finance,Business Services
AEACW,Authentic Equity Acquisition Corp. Warrant,$0.07,0.0046,7.034%,0.00,United States,2021,100,Finance,Business Services
AEAE,AltEnergy Acquisition Corp. Class A Common Stock,$9.9801,-0.0049,-0.049%,286927875.00,United States,2021,12533,Industrials,Consumer Electronics/Appliances
AEHAW,Aesther Healthcare Acquisition Corp Warrants,$0.07,0.015,27.273%,0.00,United States,2021,422,Industrials,Consumer Electronics/Appliances
AEHL,Antelope Enterprise Holdings Limited Common Stock (0.024 par),$0.9701,-0.0699,-6.721%,5866683.00,China,,25538,Consumer Discretionary,Building Products
AEHR,Aehr Test Systems Common Stock,$16.78,-1.34,-7.395%,451765037.00,United States,1997,1519285,Industrials,Electrical Products
AEI,Alset EHome International Inc. Common Stock,$0.284,-0.0242,-7.852%,32145363.00,United States,2020,565271,Real Estate,Building operators
AEIS,Advanced Energy Industries Inc. Common Stock,$90.63,-5.49,-5.712%,3404001081.00,United States,1995,157457,Consumer Discretionary,Electrical Products
AEMD,Aethlon Medical Inc. Common Stock,$1.15,-0.07,-5.738%,18204751.00,United States,,453115,Miscellaneous,Diversified Commercial Services
AEP,American Electric Power Company Inc. Common Stock,$101.82,-1.56,-1.509%,52289068000.00,United States,,2004860,Utilities,Electric Utilities: Central
AEPPZ,American Electric Power Company Inc. Corporate Units,$55.96,-0.0536,-0.096%,0.00,United States,,5044,Utilities,Electric Utilities: Central
AERC,AeroClean Technologies Inc. Common Stock,$3.93,-0.22,-5.301%,60434109.00,United States,2021,666319,Utilities,Environmental Services
AERI,Aerie Pharmaceuticals Inc. Common Stock,$15.09,-0.01,-0.066%,733720874.00,United States,2013,3098343,Health Care,Biotechnology: Biological Products (No Diagnostic Substances)
AESE,Allied Esports Entertainment Inc. Common Stock,$1.4599,0.0099,0.683%,57106773.00,United States,2017,30029,Telecommunications,Cable & Other Pay Television Services
AEY,ADDvantage Technologies Group Inc. Common Stock,$2.23,0.02,0.905%,29480281.00,United States,,54044,Consumer Discretionary,Durable Goods
AEYE,AudioEye Inc. Common Stock,$6.81,0.06,0.889%,78247458.00,United States,,9152,Technology,EDP Services
AEZS,Aeterna Zentaris Inc. Common Stock,$5.05,-0.23,-4.356%,24522174.00,Canada,,11688,,
AFACU,Arena Fortify Acquisition Corp. Unit,$10.09,0.00,0.00%,0.00,United States,2021,1,Miscellaneous,Other Pharmaceuticals
AFAQU,AF Acquisition Corp. Units,$9.83,0.00,0.00%,0.00,United States,2021,300,Industrials,Consumer Electronics/Appliances
AFAR,Aura FAT Projects Acquisition Corp Class A Ordinary Shares,$9.95,0.00,0.00%,144175500.00,Singapore,2022,45,,
AFARU,Aura FAT Projects Acquisition Corp Unit,$10.0001,0.0001,0.001%,0.00,Singapore,2022,1196,,
AFBI,Affinity Bancshares Inc. Common Stock (MD),$14.84,0.00,0.00%,98178249.00,United States,2017,345,Finance,Major Banks
AFCG,AFC Gamma Inc. Common Stock,$17.84,-0.18,-0.999%,352214050.00,United States,2021,138684,Real Estate,Real Estate Investment Trusts
AFIB,Acutus Medical Inc. Common Stock,$1.30,-0.06,-4.412%,36837171.00,United States,2020,88927,Health Care,Biotechnology: Electromedical & Electrotherapeutic Apparatus
AFMD,Affimed N.V.,$2.71,-0.27,-9.06%,404655081.00,Germany,2014,823625,Health Care,Biotechnology: Pharmaceutical Preparations
AFRI,Forafric Global PLC Ordinary Shares,$10.41,0.01,0.096%,253117974.00,Gibraltar,,418,Consumer Staples,Farming/Seeds/Milling
AFRIW,Forafric Global PLC Warrants,$0.25,0.01,4.167%,0.00,Gibraltar,,59752,Consumer Staples,Farming/Seeds/Milling
AFRM,Affirm Holdings Inc. Class A Common Stock,$24.57,-6.66,-21.326%,7037594166.00,United States,2021,39463029,Technology,EDP Services
AFYA,Afya Limited Class A Common Shares,$12.80,-0.43,-3.25%,1163052544.00,Brazil,2019,210955,Real Estate,Other Consumer Services
AGBA,AGBA Acquisition Limited Ordinary Share,$11.40,0.00,0.00%,54011729.00,Hong Kong,2019,29692,Finance,Business Services
AGBAR,AGBA Acquisition Limited Right,$0.145,-0.0038,-2.554%,0.00,Hong Kong,2019,4372,Finance,Investment Managers
AGBAW,AGBA Acquisition Limited Warrant,$0.0391,-0.0009,-2.25%,0.00,Hong Kong,2019,4000,Finance,Business Services
AGEN,Agenus Inc. Common Stock,$2.67,-0.22,-7.612%,755233738.00,United States,2000,4954727,Health Care,Biotechnology: Biological Products (No Diagnostic Substances)
AGFS,AgroFresh Solutions Inc. Common Stock,$1.63,0.03,1.875%,85821402.00,United States,2014,26926,,
AGFY,Agrify Corporation Common Stock,$0.7619,-0.0782,-9.308%,20260017.00,United States,2021,843435,Consumer Discretionary,Military/Government/Technical
AGGR,Agile Growth Corp. Class A Ordinary Share,$9.85,0.00,0.00%,381687500.00,United States,2021,2150,Finance,Business Services
AGGRU,Agile Growth Corp. Units,$9.87,0.00,0.00%,0.00,United States,2021,4456,Finance,Business Services
AGGRW,Agile Growth Corp. Warrant.,$0.091,0.0109,13.608%,0.00,United States,2021,58771,Finance,Business Services
AGIL,AgileThought Inc. Class A Common Stock,$4.48,-0.01,-0.223%,226120935.00,United States,2020,19595,Technology,EDP Services
AGILW,AgileThought Inc. Warrant,$0.5048,-0.0101,-1.962%,0.00,United States,2020,1010,Technology,EDP Services
AGIO,Agios Pharmaceuticals Inc. Common Stock,$26.80,-1.52,-5.367%,1468343244.00,United States,2013,558236,Health Care,Biotechnology: Pharmaceutical Preparations
AGLE,Aeglea BioTherapeutics Inc. Common Stock,$0.518,-0.005,-0.956%,31687360.00,United States,2016,1058208,Health Care,Biotechnology: Pharmaceutical Preparations
AGMH,AGM Group Holdings Inc. Class A Ordinary Shares,$2.32,-0.055,-2.316%,67027248.00,Hong Kong,2018,31499,Technology,EDP Services
AGNC,AGNC Investment Corp. Common Stock,$12.37,-0.16,-1.277%,6473960355.00,United States,2008,5974945,Real Estate,Real Estate Investment Trusts
AGNCM,AGNC Investment Corp. Depositary Shares rep 6.875% Series D Fixed-to-Floating Cumulative Redeemable Preferred Stock,$21.99,-0.11,-0.498%,0.00,United States,,24180,Real Estate,Real Estate Investment Trusts
AGNCN,AGNC Investment Corp. Depositary Shares Each Representing a 1/1000th Interest in a Share of 7.00% Series C Fixed-To-Floating Rate Cumulative Redeemable Preferred Stock,$24.42,0.09,0.37%,0.00,United States,,18792,Real Estate,Real Estate Investment Trusts
AGNCO,AGNC Investment Corp. Depositary Shares each representing a 1/1000th interest in a share of 6.50% Series E Fixed-to-Floating Cumulative Redeemable Preferred Stock,$22.05,0.05,0.227%,0.00,United States,,75980,Real Estate,Real Estate Investment Trusts
AGNCP,AGNC Investment Corp. Depositary Shares Each Representing a 1/1000th Interest in a Share of 6.125% Series F Fixed-to-Floating Rate Cumulative Redeemable Preferred Stock,$21.25,-0.55,-2.523%,0.00,United States,,14350,Real Estate,Real Estate Investment Trusts
AGRI,AgriFORCE  Growing Systems Ltd. Common Shares,$1.85,-0.07,-3.646%,28605270.00,Canada,2021,165820,,
AGRIW,AgriFORCE  Growing Systems Ltd. Warrant,$0.32,0.0001,0.031%,0.00,Canada,2021,1735,,
AGRX,Agile Therapeutics Inc. Common Stock,$0.4291,-0.0208,-4.623%,13520296.00,United States,2014,1909299,Health Care,Biotechnology: Pharmaceutical Preparations
AGTC,Applied Genetic Technologies Corporation Common Stock,$0.4253,-0.0066,-1.528%,28412976.00,United States,2014,398278,Health Care,Biotechnology: Biological Products (No Diagnostic Substances)
AGYS,Agilysys Inc. Common Stock (DE),$50.73,-2.19,-4.138%,1357607851.00,United States,,58507,Technology,Computer Software: Prepackaged Software
AHCO,AdaptHealth Corp. Common Stock,$19.50,-0.25,-1.266%,2618636807.00,United States,2018,1371352,Health Care,Biotechnology: Electromedical & Electrotherapeutic Apparatus
AHG,Akso Health Group ADS,$1.06,-0.16,-13.115%,75767263.00,China,2017,73781,Finance,Finance: Consumer Services
AHI,Advanced Human Imaging Limited. American Depositary Shares,$0.68,0.0978,16.798%,16198511.00,Australia,2021,386307,,
AHPA,Avista Public Acquisition Corp. II Class A Ordinary Shares,$10.165,-0.005,-0.049%,292243750.00,United States,2021,8752,,
AHPAW,Avista Public Acquisition Corp. II Warrant,$0.50,0.00,0.00%,0.00,United States,2021,7400,,
AHPI,Allied Healthcare Products Inc. Common Stock,$1.77,-0.1883,-9.615%,7103960.00,United States,1992,59869,Health Care,Industrial Specialties
AHRN,Ahren Acquisition Corp. Class A Ordinary Shares,$10.02,-0.03,-0.299%,375747495.00,Cayman Islands,2022,4141,,
AIB,AIB Acquisition Corporation Class A Ordinary Shares,$10.00,0.00,0.00%,112522250.00,United States,2022,22073,,
AIBBU,AIB Acquisition Corporation Unit,$10.03,-0.04,-0.397%,0.00,United States,2022,100,,
AIH,Aesthetic Medical International Holdings Group Ltd. American Depositary Shares,$2.07,-0.08,-3.721%,63560693.00,China,2019,2125,Health Care,Medical Specialities
AIHS,Senmiao Technology Limited Common Stock,$0.92,-0.0275,-2.902%,39890113.00,China,2018,153517,Finance,Finance: Consumer Services
AIKI,AIkido Pharma Inc. Common Stock,$6.00,-0.29,-4.61%,31515330.00,United States,,14881,Consumer Discretionary,Specialty Chemicals
AIMAW,Aimfinity Investment Corp. I Warrant,$0.0811,0.00,0.00%,0.00,United States,2022,50,,
AIMC,Altra Industrial Motion Corp. Common Stock,$40.01,-0.60,-1.477%,2603014471.00,United States,2006,247846,Industrials,Industrial Machinery/Components
AIMD,Ainos Inc. Common Stock,$2.075,-0.25,-10.753%,,United States,,45888,Health Care,Biotechnology: Pharmaceutical Preparations
AIMDW,Ainos Inc. Warrants,$0.70,0.00,0.00%,,United States,,48,Health Care,Biotechnology: Pharmaceutical Preparations
AIP,Arteris Inc. Common Stock,$7.07,-0.62,-8.062%,225809925.00,United States,2021,78080,Technology,Semiconductors
AIRG,Airgain Inc. Common Stock,$8.00,-0.045,-0.559%,81513888.00,United States,2016,16846,Technology,Radio And Television Broadcasting And Communications Equipment
AIRS,AirSculpt Technologies Inc. Common Stock,$8.95,-0.27,-2.928%,497979378.00,United States,2021,85856,Health Care,Hospital/Nursing Management
AIRT,Air T Inc. Common Stock,$17.3856,-0.4944,-2.765%,49834397.00,United States,,1414,Consumer Discretionary,Air Freight/Delivery Services
AIRTP,Air T Inc. Air T Funding Alpha Income Trust Preferred Securities,$23.00,0.31,1.366%,0.00,United States,,6589,Consumer Discretionary,Air Freight/Delivery Services
