Symbol,Name,Last Sale,Net Change,% Change,Market Cap,Country,IPO Year,Volume,Sector,Industry
PT,Pintec Technology Holdings Limited American Depositary Shares,$1.01,-0.06,-5.607%,8764740.00,China,2018,103773,Technology,Computer Software: Programming Data Processing
PTC,PTC Inc. Common Stock,$114.59,-4.73,-3.964%,13404273423.00,United States,,684450,Technology,Computer Software: Prepackaged Software
PTCT,PTC Therapeutics Inc. Common Stock,$50.38,-2.19,-4.166%,3594022496.00,United States,2013,825176,Health Care,Biotechnology: Pharmaceutical Preparations
PTE,PolarityTE Inc. Common Stock,$0.9528,-0.0272,-2.776%,4253605.00,United States,,426791,Consumer Discretionary,Specialty Chemicals
PTEN,Patterson-UTI Energy Inc. Common Stock,$15.70,-0.69,-4.21%,3395960240.00,United States,1993,2549603,Energy,Oil & Gas Production
PTGX,Protagonist Therapeutics Inc. Common Stock,$9.33,-0.71,-7.072%,453962243.00,United States,2016,1176544,Health Care,Biotechnology: Pharmaceutical Preparations
PTIC,PropTech Investment Corporation II Class A Common Stock,$9.91,0.00,0.00%,284912500.00,United States,2021,720,Industrials,Consumer Electronics/Appliances
PTICU,PropTech Investment Corporation II Unit,$9.94,0.00,0.00%,0.00,United States,2020,2545,Industrials,Consumer Electronics/Appliances
PTICW,PropTech Investment Corporation II Warrant,$0.16,-0.01,-5.882%,0.00,United States,2021,30092,Industrials,Consumer Electronics/Appliances
PTIX,Protagenic Therapeutics Inc. Common Stock,$0.73,-0.0672,-8.43%,12618241.00,United States,,29209,Health Care,Biotechnology: Pharmaceutical Preparations
PTIXW,Protagenic Therapeutics Inc. Warrant,$0.0517,-0.0183,-26.143%,0.00,United States,,11070,Health Care,Biotechnology: Pharmaceutical Preparations
PTLO,Portillo's Inc. Class A Common Stock,$23.05,-0.57,-2.413%,826277292.00,United States,2021,609001,Consumer Discretionary,Restaurants
PTMN,Portman Ridge Finance Corporation Common Stock,$22.51,-0.17,-0.75%,218666372.00,United States,2006,11833,Finance,Finance/Investors Services
PTNR,Partner Communications Company Ltd. American Depositary Shares,$8.39,-0.09,-1.061%,1553300663.00,Israel,,737,Telecommunications,Telecommunications Equipment
PTOC,Pine Technology Acquisition Corp. Class A Common Stock,$9.83,0.008,0.081%,423918750.00,United States,2021,1175059,Industrials,Consumer Electronics/Appliances
PTOCU,Pine Technology Acquisition Corp. Unit,$9.84,0.00,0.00%,0.00,United States,2021,128,Industrials,Consumer Electronics/Appliances
PTOCW,Pine Technology Acquisition Corp. Warrant,$0.0703,0.00,0.00%,0.00,United States,2021,2873,Industrials,Consumer Electronics/Appliances
PTON,Peloton Interactive Inc. Class A Common Stock,$10.61,-0.40,-3.633%,3579355457.00,United States,2019,25491635,Consumer Discretionary,Other Consumer Services
PTPI,Petros Pharmaceuticals Inc. Common Stock,$0.6904,-0.013,-1.848%,14280733.00,United States,,132461,Health Care,Biotechnology: Pharmaceutical Preparations
PTRA,Proterra Inc. Common Stock,$6.10,-0.34,-5.28%,1360300000.00,United States,2020,1103839,Consumer Discretionary,Auto Manufacturing
PTRS,Partners Bancorp Common Stock,$9.28,-0.05,-0.536%,166684567.00,United States,,560,Finance,Major Banks
PTSI,P.A.M. Transportation Services Inc. Common Stock,$32.09,-1.88,-5.534%,714557721.00,United States,1986,28194,Industrials,Trucking Freight/Courier Services
PTVE,Pactiv Evergreen Inc. Common stock,$11.18,-0.58,-4.932%,1986332734.00,United States,2020,145949,Consumer Discretionary,Containers/Packaging
PTWOU,Pono Capital Two Inc. Unit,$10.03,0.00,0.00%,,United States,2022,32122,Industrials,Consumer Electronics/Appliances
PUBM,PubMatic Inc. Class A Common Stock,$20.15,-0.73,-3.496%,963704056.00,United States,2020,618104,Technology,Computer Software: Prepackaged Software
PUCK,Goal Acquisitions Corp. Common Stock,$9.8507,0.00,0.00%,326661525.00,United States,2021,1,Industrials,Consumer Electronics/Appliances
PUCKU,Goal Acquisitions Corp. Unit,$9.97,-0.03,-0.30%,0.00,United States,2021,300,Industrials,Consumer Electronics/Appliances
PUCKW,Goal Acquisitions Corp. Warrant,$0.0882,-0.001,-1.121%,0.00,United States,2021,100,Industrials,Consumer Electronics/Appliances
PULM,Pulmatrix Inc. Common Stock,$4.66,-0.17,-3.52%,15784222.00,United States,2014,298701,Health Care,Biotechnology: Pharmaceutical Preparations
PUYI,Puyi Inc. American Depository Shares,$8.10,0.09,1.124%,488548876.00,China,2019,427,Finance,Investment Managers
PVBC,Provident Bancorp Inc. (MD) Common Stock,$14.52,-0.32,-2.156%,258621194.00,United States,2015,15922,Finance,Major Banks
PWFL,PowerFleet Inc. Common Stock,$3.47,0.06,1.76%,125360673.00,United States,,49351,Telecommunications,Telecommunications Equipment
PWOD,Penns Woods Bancorp Inc. Common Stock,$24.00,-0.04,-0.166%,169174560.00,United States,,11528,Finance,Major Banks
PWP,Perella Weinberg Partners Class A Common Stock,$7.38,-0.33,-4.28%,726934288.00,United States,2020,172471,Finance,Investment Bankers/Brokers/Service
PWPPW,Perella Weinberg Partners Warrant,$1.50,0.14,10.294%,0.00,United States,2020,300,Finance,Investment Bankers/Brokers/Service
PWUP,PowerUp Acquisition Corp. Class A Ordinary Shares,$10.07,-0.01,-0.099%,361890625.00,United States,2022,226,,
PWUPU,PowerUp Acquisition Corp. Unit,$10.13,-0.0101,-0.10%,0.00,United States,2022,1847,,
PWUPW,PowerUp Acquisition Corp. Warrant,$0.1601,0.0001,0.063%,0.00,United States,2022,818,,
PXLW,Pixelworks Inc.  Common Stock,$2.00,-0.07,-3.382%,107996024.00,United States,2000,198888,Technology,Semiconductors
PXMD,PaxMedica Inc. Common Stock,$4.91,-0.34,-6.476%,48390775.00,United States,,8392101,Health Care,Biotechnology: Pharmaceutical Preparations
PXS,Pyxis Tankers Inc. Common Stock,$3.23,-0.12,-3.582%,69638429.00,Greece,,53390,Consumer Discretionary,Marine Transportation
PXSAP,Pyxis Tankers Inc. 7.75% Series A Cumulative Convertible Preferred Shares,$20.2499,-0.2701,-1.316%,0.00,Greece,,2934,Consumer Discretionary,Marine Transportation
PYCR,Paycor HCM Inc. Common Stock,$29.03,-1.06,-3.523%,5077623917.00,United States,2021,794676,Technology,Computer Software: Prepackaged Software
PYPD,PolyPid Ltd. Ordinary Shares,$6.09,-0.16,-2.56%,118576910.00,Israel,2020,15941,Health Care,Medical/Dental Instruments
PYPL,PayPal Holdings Inc. Common Stock,$92.70,-4.02,-4.156%,107350301418.00,United States,,12280887,Consumer Discretionary,Business Services
PYR,PyroGenesis Canada Inc. Common Shares,$1.43,-0.03,-2.055%,243279883.00,Canada,,23778,,
PYXS,Pyxis Oncology Inc. Common Stock,$2.77,-0.21,-7.047%,90903262.00,United States,2021,24878,Health Care,Biotechnology: Pharmaceutical Preparations
PZZA,Papa John's International Inc. Common Stock,$82.03,-4.02,-4.672%,2936256139.00,United States,1993,436242,Consumer Discretionary,Restaurants
QCOM,QUALCOMM Incorporated Common Stock,$138.38,-7.87,-5.381%,154985600000.00,United States,1991,7911297,Technology,Computer peripheral equipment
QCRH,QCR Holdings Inc. Common Stock,$58.46,-0.46,-0.781%,1031902306.00,United States,,54823,Finance,Major Banks
QDEL,QuidelOrtho Corporation Common Stock,$82.06,-2.58,-3.048%,5492217127.00,United States,,591748,Health Care,Medical/Dental Instruments
QFIN,360 DigiTech Inc. American Depositary Shares,$16.47,0.60,3.781%,2557112551.00,China,2018,1996972,Finance,Finance: Consumer Services
QH,Quhuo Limited American Depository Shares,$3.99,-0.1953,-4.666%,176703450.00,China,2020,133229,Consumer Discretionary,Business Services
QIPT,Quipt Home Medical Corp. Common Shares,$5.17,0.17,3.40%,173355270.00,United States,,120938,,
QK,Q&K International Group Limited American Depositary Shares,$3.15,-0.14,-4.255%,543247529.00,China,2019,6873,Finance,Real Estate
QLGN,Qualigen Therapeutics Inc. Common Stock,$0.39,0.00,0.00%,15130261.00,United States,2015,471645,Health Care,Biotechnology: Commercial Physical & Biological Resarch
QLI,Qilian International Holding Group Ltd. Ordinary Shares,$1.21,0.0681,5.964%,43257500.00,China,2021,3997,Health Care,Biotechnology: Pharmaceutical Preparations
QLYS,Qualys Inc. Common Stock,$154.06,-4.12,-2.605%,5982774205.00,United States,2012,316575,Technology,EDP Services
QMCO,Quantum Corporation Common Stock,$1.65,-0.04,-2.367%,149499621.00,United States,,262544,Technology,Electronic Components
QNCX,Quince Therapeutics Inc. Common Stock,$1.85,0.02,1.093%,,United States,2019,399676,Health Care,Biotechnology: Biological Products (No Diagnostic Substances)
QNRX,Quoin Pharmaceuticals Ltd. American Depositary Shares,$3.68,-0.35,-8.685%,36927453.00,Israel,2016,754257,Health Care,Medical/Dental Instruments
QNST,QuinStreet Inc. Common Stock,$12.35,-0.45,-3.516%,676867426.00,United States,2010,175403,Consumer Discretionary,Advertising
QQQX,Nuveen NASDAQ 100 Dynamic Overwrite Fund Shares of Beneficial Interest,$23.48,-0.53,-2.207%,1059765174.00,United States,,173810,Finance,Finance Companies
QRHC,Quest Resource Holding Corporation Common Stock,$6.86,0.36,5.538%,130777037.00,United States,,42150,Consumer Discretionary,Building Products
QRTEA,Qurate Retail Inc. Series A Common Stock ,$3.15,-0.14,-4.255%,1203330177.00,United States,,4170500,Consumer Discretionary,Catalog/Specialty Distribution
QRTEB,Qurate Retail Inc. Series B Common Stock ,$9.04,-0.49,-5.142%,3453366603.00,United States,,45604,Consumer Discretionary,Catalog/Specialty Distribution
QRTEP,Qurate Retail Inc. 8.0% Fixed Rate Cumulative Redeemable Preferred Stock,$60.53,-0.68,-1.111%,0.00,United States,,43351,Consumer Discretionary,Catalog/Specialty Distribution
QRVO,Qorvo Inc. Common Stock,$95.70,-6.26,-6.14%,9926650454.00,United States,,1187881,Industrials,Industrial Machinery/Components
QSI,Quantum-Si Incorporated Class A Common Stock,$3.22,-0.22,-6.395%,448164842.00,United States,2020,409541,Health Care,Biotechnology: Pharmaceutical Preparations
QSIAW,Quantum-Si Incorporated Warrant,$0.7675,0.1275,19.922%,0.00,United States,2020,100,Health Care,Biotechnology: Pharmaceutical Preparations
QTEK,QualTek Services Inc. Class A Common Stock,$1.97,0.03,1.546%,48159179.00,United States,2021,116387,Consumer Discretionary,Telecommunications Equipment
QTEKW,QualTek Services Inc. Warrant,$0.30,0.0499,19.952%,0.00,United States,2021,1312,Consumer Discretionary,Telecommunications Equipment
QTNT,Quotient Limited Ordinary Shares,$0.2084,-0.0143,-6.421%,28274536.00,Switzerland,2014,1665127,Health Care,Biotechnology: Pharmaceutical Preparations
QTRX,Quanterix Corporation Common Stock,$9.48,-0.57,-5.672%,349908099.00,United States,2017,337042,Health Care,Industrial Specialties
QTT,Qutoutiao Inc. American Depositary Shares,$0.895,0.0149,1.693%,25924877.00,China,2018,117307,Technology,Computer Software: Prepackaged Software
QUBT,Quantum Computing Inc. Common Stock,$3.15,-0.23,-6.805%,91843967.00,United States,,202095,Technology,Computer Manufacturing
QUIK,QuickLogic Corporation Common Stock,$6.90,-0.25,-3.497%,85529840.00,United States,1999,57425,Technology,Semiconductors
QUMU,Qumu Corporation Common Stock,$0.6396,-0.0229,-3.457%,11413349.00,United States,,40372,Technology,Retail: Computer Software & Peripheral Equipment
QURE,uniQure N.V. Ordinary Shares,$19.84,-0.98,-4.707%,925488781.00,Netherlands,2014,659242,Health Care,Biotechnology: Pharmaceutical Preparations
RACB,Research Alliance Corp. II Class A Common Stock,$9.81,0.00,0.00%,188219565.00,United States,2021,29,Industrials,Consumer Electronics/Appliances
RACYW,Relativity Acquisition Corp. Warrant,$0.08,0.00,0.00%,0.00,United States,2022,800,Industrials,Consumer Electronics/Appliances
RADA,RADA Electronic Industries Ltd. Ordinary Shares,$10.41,-0.13,-1.233%,452679527.00,Israel,,89450,Technology,Electronic Components
RADI,Radius Global Infrastructure Inc. Class A Common Stock,$14.24,-0.26,-1.793%,1320520640.00,United States,,375285,Consumer Discretionary,Telecommunications Equipment
RAIL,FreightCar America Inc. Common Stock,$4.51,-0.25,-5.252%,74574050.00,United States,2005,100797,Industrials,Railroads
RAIN,Rain Therapeutics Inc. Common Stock,$6.54,-0.11,-1.654%,173505402.00,United States,2021,55547,Health Care,Biotechnology: Pharmaceutical Preparations
RAM,Aries I Acquisition Corporation Class A Ordinary Share,$10.58,-0.27,-2.488%,190109375.00,Cayman Islands,2021,120804,Finance,Business Services
RAMMU,Aries I Acquisition Corporation Unit,$10.57,-0.19,-1.766%,0.00,Cayman Islands,2021,656,Finance,Business Services
RAMMW,Aries I Acquisition Corporation Warrant,$0.155,0.0184,13.47%,0.00,Cayman Islands,2021,39004,Finance,Business Services
RAND,Rand Capital Corporation Common Stock,$14.30,0.00,0.00%,36908600.00,United States,,227,Finance,Finance/Investors Services
RANI,Rani Therapeutics Holdings Inc. Class A Common Stock,$9.40,-0.60,-6.00%,230193150.00,United States,2021,48244,Consumer Discretionary,Specialty Chemicals
RAPT,RAPT Therapeutics Inc. Common Stock,$28.17,-2.29,-7.518%,835150948.00,United States,2019,219756,Health Care,Biotechnology: Pharmaceutical Preparations
RARE,Ultragenyx Pharmaceutical Inc. Common Stock,$49.50,-1.96,-3.809%,3461544455.00,United States,2014,511200,Health Care,Biotechnology: Pharmaceutical Preparations
RAVE,Rave Restaurant Group Inc. Common Stock,$1.29,-0.03,-2.273%,23226326.00,United States,,38462,Consumer Discretionary,Restaurants
RBB,RBB Bancorp Common Stock,$22.37,-0.38,-1.67%,429319694.00,United States,2017,20279,Finance,Commercial Banks
RBBN,Ribbon Communications Inc. Common Stock,$3.53,0.00,0.00%,529990903.00,United States,,209970,Technology,EDP Services
RBCAA,Republic Bancorp Inc. Class A Common Stock,$43.83,-0.89,-1.99%,865273451.00,United States,1998,24953,Finance,Major Banks
RBCN,Rubicon Technology Inc. Common Stock,$14.05,-0.84,-5.641%,34375461.00,United States,2007,32416,Technology,Semiconductors
RBKB,Rhinebeck Bancorp Inc. Common Stock,$9.58,0.00,0.00%,108216667.00,United States,2019,52,Finance,Major Banks
RCAC,Revelstone Capital Acquisition Corp. Class A Common Stock,$9.88,-0.01,-0.101%,203775000.00,United States,2022,120,Industrials,Consumer Electronics/Appliances
RCACU,Revelstone Capital Acquisition Corp. Unit,$9.85,0.02,0.203%,203156250.00,United States,2021,2513,Industrials,Consumer Electronics/Appliances
RCACW,Revelstone Capital Acquisition Corp. Warrant,$0.1003,0.00,0.00%,0.00,United States,2022,700,Industrials,Consumer Electronics/Appliances
RCAT,Red Cat Holdings Inc. Common Stock,$2.27,-0.05,-2.155%,122144099.00,United States,,182637,Industrials,Wholesale Distributors
RCEL,Avita Medical Inc. Common Stock,$6.67,-0.11,-1.622%,166453725.00,United States,,44602,Health Care,Medical Specialities
RCHG,Recharge Acquisition Corp. Class A Common Stock,$10.08,0.005,0.05%,252504000.00,United States,2020,25004,Industrials,Consumer Electronics/Appliances
RCHGU,Recharge Acquisition Corp. Unit,$10.08,0.00,0.00%,0.00,United States,2020,20864,Industrials,Consumer Electronics/Appliances
RCHGW,Recharge Acquisition Corp. Warrant,$0.0348,0.0002,0.578%,0.00,United States,2020,1300,Industrials,Consumer Electronics/Appliances
RCII,Rent-A-Center Inc. Common Stock,$27.05,-1.77,-6.142%,1599819394.00,United States,1995,729855,Consumer Discretionary,Diversified Commercial Services
RCKT,Rocket Pharmaceuticals Inc. Common Stock,$16.21,-2.20,-11.95%,1067232262.00,United States,2015,809449,Health Care,Biotechnology: Pharmaceutical Preparations
RCKY,Rocky Brands Inc. Common Stock,$26.77,-1.23,-4.393%,195771018.00,United States,1993,25585,Consumer Discretionary,Shoe Manufacturing
RCLF,Rosecliff Acquisition Corp I Class A Common Stock,$9.85,0.00,0.00%,311506250.00,United States,2021,30,Industrials,Consumer Electronics/Appliances
RCLFU,Rosecliff Acquisition Corp I Unit,$9.84,-0.02,-0.203%,0.00,United States,2021,3600,Industrials,Consumer Electronics/Appliances
RCM,R1 RCM Inc. Common Stock,$22.46,-1.29,-5.432%,6282171582.00,United States,,2216071,Consumer Discretionary,Other Consumer Services
RCMT,RCM Technologies Inc. Common Stock,$17.75,-0.64,-3.48%,179892043.00,United States,,56638,Industrials,Consumer Electronics/Appliances
RCON,Recon Technology Ltd. Class A Ordinary Shares,$0.6973,-0.0182,-2.544%,5022535.00,China,2009,156996,Energy,Oilfield Services/Equipment
RCRT,Recruiter.com Group Inc. Common Stock,$1.29,-0.04,-3.008%,19204747.00,United States,,15953,Technology,Interactive Media
RDCM,Radcom Ltd. Ordinary Shares,$11.95,-0.05,-0.417%,173105191.00,Israel,1997,11393,Technology,Computer peripheral equipment
RDFN,Redfin Corporation Common Stock,$9.02,-0.55,-5.747%,966706576.00,United States,2017,2854473,Finance,Real Estate
RDHL,Redhill Biopharma Ltd. American Depositary Shares,$1.02,-0.01,-0.971%,65099928.00,Israel,,1167505,Health Care,Biotechnology: Pharmaceutical Preparations
RDI,Reading International Inc Class A Common Stock,$4.28,-0.10,-2.283%,94347567.00,United States,,14816,Consumer Discretionary,Movies/Entertainment
RDIB,Reading International Inc Class B Common Stock,$21.09,0.07,0.333%,464904248.00,United States,,1880,Consumer Discretionary,Movies/Entertainment
RDNT,RadNet Inc. Common Stock,$21.00,-0.99,-4.502%,1180608933.00,United States,,242086,Health Care,Medical Specialities
RDVT,Red Violet Inc. Common Stock ,$19.39,-0.76,-3.772%,262212269.00,United States,,68911,Technology,Computer Software: Prepackaged Software
RDWR,Radware Ltd. Ordinary Shares,$20.59,-0.65,-3.06%,923271434.00,Israel,1999,199870,Consumer Discretionary,Business Services
REAL,The RealReal Inc. Common Stock,$2.27,-0.11,-4.622%,214227218.00,United States,2019,4180842,Consumer Discretionary,Consumer Specialties
REAX,The Real Brokerage Inc. Common Shares,$1.87,-0.01,-0.532%,333408076.00,Canada,,67409,,
REBN,Reborn Coffee Inc. Common Stock,$2.80,-0.15,-5.085%,,United States,2022,215130,Consumer Discretionary,Restaurants
REE,REE Automotive Ltd. Class A Ordinary Shares,$1.17,-0.17,-12.687%,278980156.00,Israel,,1770339,,
REEAW,REE Automotive Ltd. Warrant,$0.23,0.08,53.333%,0.00,Israel,,222327,,
REED,Reeds Inc. Common Stock,$0.214,-0.0045,-2.059%,24107596.00,United States,,227189,Consumer Staples,Beverages (Production/Distribution)
REFI,Chicago Atlantic Real Estate Finance Inc. Common Stock,$15.32,-0.26,-1.669%,270519227.00,United States,2021,35656,Real Estate,Real Estate Investment Trusts
REFR,Research Frontiers Incorporated Common Stock,$2.21,-0.05,-2.212%,69947375.00,United States,,73680,Technology,Industrial Machinery/Components
REG,Regency Centers Corporation Common Stock,$62.85,-0.97,-1.52%,10832972629.00,United States,1993,1019517,Real Estate,Real Estate Investment Trusts
REGN,Regeneron Pharmaceuticals Inc. Common Stock,$596.18,-7.62,-1.262%,65488103939.00,United States,1991,516168,Health Care,Biotechnology: Pharmaceutical Preparations
REKR,Rekor Systems Inc. Common Stock,$1.30,-0.14,-9.722%,64837144.00,United States,,458193,Technology,EDP Services
RELI,Reliance Global Group Inc. Common Stock,$0.7396,0.0211,2.937%,10808543.00,United States,,352642,Finance,Specialty Insurers
RELIW,Reliance Global Group Inc. Series A Warrants,$0.2001,0.00,0.00%,0.00,United States,,10,Finance,Specialty Insurers
RELL,Richardson Electronics Ltd. Common Stock,$17.41,-0.36,-2.026%,238551820.00,United States,1983,96369,Technology,Electronic Components
RELY,Remitly Global Inc. Common Stock,$10.82,-0.68,-5.913%,1798873365.00,United States,2021,800511,Technology,Computer Software: Prepackaged Software
RENE,Cartesian Growth Corporation II Class A Ordinary Shares,$10.04,0.03,0.30%,288650000.00,United States,2022,575,,
RENEU,Cartesian Growth Corporation II Unit,$10.07,-0.031,-0.307%,0.00,United States,2022,10602,,
RENEW,Cartesian Growth Corporation II Warrant,$0.1701,0.00,0.00%,0.00,United States,2022,51,,
RENT,Rent the Runway Inc. Class A Common Stock,$5.26,-0.45,-7.881%,337029072.00,United States,2021,558424,Consumer Discretionary,Department/Specialty Retail Stores
REPL,Replimune Group Inc. Common Stock,$19.17,-1.51,-7.302%,940671804.00,United States,2018,355218,Health Care,Biotechnology: Pharmaceutical Preparations
RETA,Reata Pharmaceuticals Inc. Class A Common Stock,$24.62,-0.92,-3.602%,897718666.00,United States,2016,467346,Health Care,Biotechnology: Pharmaceutical Preparations
RETO,ReTo Eco-Solutions Inc. Common Shares,$0.5924,-0.0176,-2.885%,22000618.00,China,2017,158184,Consumer Discretionary,Multi-Sector Companies
REUN,Reunion Neuroscience Inc. Common Shares,$3.68,-0.02,-0.541%,,Canada,,51739,,
REVB,Revelation Biosciences Inc. Common Stock,$0.416,-0.0039,-0.929%,6274433.00,United States,2020,309590,Health Care,Biotechnology: Pharmaceutical Preparations
REVBU,Revelation Biosciences Inc. Unit,$0.4894,-0.0206,-4.039%,0.00,United States,2020,56694,Health Care,Biotechnology: Pharmaceutical Preparations
REVBW,Revelation Biosciences Inc. Warrant,$0.09,0.0048,5.634%,0.00,United States,2020,15275,Health Care,Biotechnology: Pharmaceutical Preparations
REVE,Alpine Acquisition Corporation Common Stock,$10.22,0.00,0.00%,138481000.00,United States,2021,1,Industrials,Consumer Electronics/Appliances
REVH,Revolution Healthcare Acquisition Corp. SAIL Class A Common Stock,$9.82,0.01,0.102%,567105000.00,United States,2021,6735,Industrials,Consumer Electronics/Appliances
REVHU,Revolution Healthcare Acquisition Corp. SAIL Units,$9.83,0.005,0.051%,0.00,United States,2021,330,Industrials,Consumer Electronics/Appliances
REVHW,Revolution Healthcare Acquisition Corp. SAIL Warrant.,$0.1501,0.0001,0.067%,0.00,United States,2021,13710,Industrials,Consumer Electronics/Appliances
REYN,Reynolds Consumer Products Inc. Common Stock,$27.76,-0.36,-1.28%,5825787386.00,United States,2020,214054,Industrials,Office Equipment/Supplies/Services
RFAC,RF Acquisition Corp. Class A Common Stock,$9.89,0.00,0.00%,144146750.00,Singapore,2022,12914,Industrials,Consumer Electronics/Appliances
RFACW,RF Acquisition Corp. Warrants,$0.0501,-0.0049,-8.909%,0.00,Singapore,2022,26200,Industrials,Consumer Electronics/Appliances
RFIL,RF Industries Ltd. Common Stock,$6.8385,-0.0315,-0.459%,69196627.00,United States,,4505,Technology,Electrical Products
RGC,Regencell Bioscience Holdings Limited Ordinary Shares,$29.38,-0.1401,-0.475%,382318003.00,Hong Kong,2021,902,,
RGCO,RGC Resources Inc. Common Stock,$21.31,-0.08,-0.374%,208655203.00,United States,,6295,Utilities,Oil & Gas Production
RGEN,Repligen Corporation Common Stock,$227.15,-10.50,-4.418%,12591642521.00,United States,1986,249213,Health Care,Medical/Dental Instruments
RGF,The Real Good Food Company Inc. Class A Common Stock,$6.9101,-0.3499,-4.82%,177918256.00,United States,2021,6548,Consumer Discretionary,Food Distributors
RGLD,Royal Gold Inc. Common Stock,$96.26,-3.29,-3.305%,6318412258.00,United States,,342924,Industrials,Consumer Electronics/Appliances
RGLS,Regulus Therapeutics Inc. Common Stock,$1.55,-0.07,-4.321%,22627083.00,United States,2012,97132,Health Care,Biotechnology: Pharmaceutical Preparations
RGNX,REGENXBIO Inc. Common Stock,$31.19,-2.68,-7.913%,1345347183.00,United States,2015,306449,Health Care,Biotechnology: Biological Products (No Diagnostic Substances)
RGP,Resources Connection Inc. Common Stock,$20.47,-0.65,-3.078%,677655379.00,United States,,130186,Consumer Discretionary,Business Services
RGTI,Rigetti Computing Inc. Common Stock,$3.99,-0.26,-6.118%,458274071.00,United States,,929040,Technology,Retail: Computer Software & Peripheral Equipment
RGTIW,Rigetti Computing Inc. Warrants,$0.6002,-0.1198,-16.639%,0.00,United States,,23399,Technology,Retail: Computer Software & Peripheral Equipment
RIBT,RiceBran Technologies Common Stock,$2.571,-0.405,-13.609%,134489792.00,United States,,254176,Consumer Staples,Specialty Foods
RICK,RCI Hospitality Holdings Inc. Common Stock,$67.10,-4.42,-6.18%,623103886.00,United States,1995,66850,Consumer Discretionary,Restaurants
RIDE,Lordstown Motors Corp. Class A Common Stock,$2.06,-0.10,-4.63%,424095416.00,United States,2019,2561803,Consumer Discretionary,Construction/Ag Equipment/Trucks
RIGL,Rigel Pharmaceuticals Inc. Common Stock,$1.47,-0.13,-8.125%,252916769.00,United States,2000,3466307,Health Care,Biotechnology: Pharmaceutical Preparations
RILY,B. Riley Financial Inc. Common Stock,$51.95,-1.56,-2.915%,1450871756.00,United States,,122577,Finance,Investment Managers
RILYG,B. Riley Financial Inc. 5.00% Senior Notes due 2026,$22.55,-0.4721,-2.051%,0.00,United States,,23917,Consumer Discretionary,Business Services
RILYK,B. Riley Financial Inc. 5.50% Senior Notes Due 2026,$23.90,-0.05,-0.209%,0.00,United States,,15762,Consumer Discretionary,Business Services
RILYL,B. Riley Financial Inc. Depositary Shares each representing 1/1000th in a share of 7.375% Series B Cumulative Perpetual Preferred Stock par value $0.0001,$25.55,-0.095,-0.37%,0.00,United States,,2953,Finance,Investment Managers
RILYM,B. Riley Financial Inc. 6.375% Senior Notes due 2025,$24.9309,-0.0691,-0.276%,0.00,United States,,964,Consumer Discretionary,Business Services
RILYN,B. Riley Financial Inc. 6.50% Senior Notes Due 2026,$24.575,-0.125,-0.506%,0.00,United States,,4525,Consumer Discretionary,Business Services
RILYO,B. Riley Financial Inc. 6.75% Senior Notes due 2024,$24.9849,-0.0651,-0.26%,0.00,United States,,20943,Consumer Discretionary,Business Services
RILYP,B. Riley Financial Inc. Depositary Shares each representing a 1/1000th fractional interest in a share of Series A Cumulative Perpetual Preferred Stock,$23.81,-0.39,-1.612%,0.00,United States,,3990,Finance,Investment Managers
RILYT,B. Riley Financial Inc. 6.00% Senior Notes Due 2028,$23.15,0.25,1.092%,0.00,United States,,21298,Consumer Discretionary,Business Services
RILYZ,B. Riley Financial Inc. 5.25% Senior Notes due 2028,$21.57,-0.055,-0.254%,0.00,United States,,9091,Consumer Discretionary,Business Services
RIOT,Riot Blockchain Inc.  Common Stock ,$6.79,-0.64,-8.614%,919012241.00,United States,,13266583,Technology,Retail: Computer Software & Peripheral Equipment
RIVN,Rivian Automotive Inc. Class A Common Stock,$32.11,-0.79,-2.401%,28920117430.00,United States,2021,10709957,Consumer Discretionary,Auto Manufacturing
RKDA,Arcadia Biosciences Inc. Common Stock,$0.832,-0.0281,-3.267%,18461180.00,United States,2015,154092,Industrials,Agricultural Chemicals
