Symbol,Name,Last Sale,Net Change,% Change,Market Cap,Country,IPO Year,Volume,Sector,Industry
IMTE,Integrated Media Technology Limited Ordinary Shares,$1.34,-0.10,-6.944%,19769464.00,Australia,,312708,Consumer Staples,Consumer Electronics/Appliances
IMTX,Immatics N.V. Ordinary Shares,$12.32,-0.12,-0.965%,775258373.00,Germany,,236010,Health Care,Biotechnology: Biological Products (No Diagnostic Substances)
IMTXW,Immatics N.V. Warrants,$3.80,0.00,0.00%,0.00,Germany,,4325,Health Care,Biotechnology: Biological Products (No Diagnostic Substances)
IMUX,Immunic Inc. Common Stock,$4.69,-0.47,-9.109%,143234396.00,United States,2014,110137,Health Care,Biotechnology: Pharmaceutical Preparations
IMV,IMV Inc. Common Shares,$0.69,-0.06,-8.00%,56765929.00,Canada,,118564,,
IMVT,Immunovant Inc. Common Stock,$5.93,-0.44,-6.907%,485143541.00,United States,2019,371938,Health Care,Biotechnology: Pharmaceutical Preparations
IMXI,International Money Express Inc. Common Stock,$24.11,-0.68,-2.743%,926841346.00,United States,2017,265956,Technology,Retail: Computer Software & Peripheral Equipment
INAB,IN8bio Inc. Common Stock,$1.96,-0.08,-3.922%,36923403.00,United States,2021,155064,Health Care,Biotechnology: Pharmaceutical Preparations
INBK,First Internet Bancorp Common Stock,$36.78,-1.14,-3.006%,345879120.00,United States,,27991,Finance,Major Banks
INBKZ,First Internet Bancorp 6.0% Fixed-to-Floating Rate Subordinated Notes Due 2029,$24.866,0.00,0.00%,0.00,United States,,27,Finance,Major Banks
INBX,Inhibrx Inc. Common Stock,$19.66,-2.09,-9.609%,767474163.00,United States,2020,278379,Health Care,Biotechnology: Pharmaceutical Preparations
INCR,Intercure Ltd. Ordinary Shares,$5.30,-0.07,-1.304%,239209909.00,Israel,,17249,,
INCY,Incyte Corp. Common Stock,$71.48,-1.20,-1.651%,15833178186.00,United States,,1252730,Health Care,Biotechnology: Commercial Physical & Biological Resarch
INDB,Independent Bank Corp. Common Stock,$79.89,-0.81,-1.004%,3680513206.00,United States,,204355,Finance,Major Banks
INDI,indie Semiconductor Inc. Class A Common Stock,$8.04,-0.15,-1.832%,954570708.00,United States,,1695352,Technology,Semiconductors
INDIW,indie Semiconductor Inc. Warrant,$1.93,-0.0199,-1.021%,0.00,United States,,40086,Technology,Semiconductors
INDP,Indaptus Therapeutics Inc. Common Stock,$2.46,0.01,0.408%,20316149.00,United States,,13630,Health Care,Biotechnology: Pharmaceutical Preparations
INDT,INDUS Realty Trust Inc. (MD) Common Stock,$63.37,0.17,0.269%,645495882.00,United States,,45582,Finance,Real Estate
INFI,Infinity Pharmaceuticals Inc. Common Stock,$1.47,-0.14,-8.696%,131058307.00,United States,,321425,Health Care,Biotechnology: Pharmaceutical Preparations
INFN,Infinera Corporation Common Stock,$5.78,-0.18,-3.02%,1243826632.00,United States,2007,2021207,Utilities,Telecommunications Equipment
INGN,Inogen Inc Common Stock,$29.49,-1.61,-5.177%,673427565.00,United States,2014,85354,Health Care,Industrial Specialties
INKA,KludeIn I Acquisition Corp. Class A Common Stock,$10.03,-0.05,-0.496%,216271875.00,United States,2021,425,Industrials,Consumer Electronics/Appliances
INKAU,KludeIn I Acquisition Corp. Unit,$10.04,-0.062,-0.614%,0.00,United States,2021,445,Industrials,Consumer Electronics/Appliances
INKAW,KludeIn I Acquisition Corp. Warrant,$0.11,0.00,0.00%,0.00,United States,2021,307,Industrials,Consumer Electronics/Appliances
INKT,MiNK Therapeutics Inc. Common Stock,$2.35,-0.13,-5.242%,78868148.00,United States,2021,61013,Consumer Discretionary,Specialty Chemicals
INM,InMed Pharmaceuticals Inc. Common Shares,$0.2601,0.01,3.998%,4230965.00,Canada,,779098,,
INMB,INmune Bio Inc. Common stock,$8.33,-0.59,-6.614%,149490138.00,United States,2019,39070,Health Care,Biotechnology: Pharmaceutical Preparations
INMD,InMode Ltd. Ordinary Shares,$32.21,-2.26,-6.556%,2676041587.00,Israel,2019,2166492,Health Care,Medical/Nursing Services
INNV,InnovAge Holding Corp. Common Stock,$3.88,-0.16,-3.96%,525837023.00,United States,2021,92918,Health Care,Hospital/Nursing Management
INO,Inovio Pharmaceuticals Inc. Common Stock,$2.29,-0.205,-8.216%,524504151.00,United States,,6368116,Health Care,Biotechnology: Biological Products (No Diagnostic Substances)
INOD,Innodata Inc. Common Stock,$3.45,-0.05,-1.429%,93766301.00,United States,1993,93557,Technology,EDP Services
INPX,Inpixon Common Stock,$0.1475,0.003,2.076%,22490262.00,United States,2014,958845,Technology,Computer Software: Prepackaged Software
INSE,Inspired Entertainment Inc. Common Stock,$11.02,-0.28,-2.478%,296341751.00,United States,2014,119150,Technology,EDP Peripherals
INSG,Inseego Corp. Common Stock,$2.70,-0.22,-7.534%,290586612.00,United States,,504669,Telecommunications,Telecommunications Equipment
INSM,Insmed Inc. Common Stock,$24.50,-1.61,-6.166%,2928171621.00,United States,,1298839,Health Care,Biotechnology: Pharmaceutical Preparations
INTA,Intapp Inc. Common Stock,$14.36,-0.97,-6.327%,893512759.00,United States,2021,42098,Technology,Computer Software: Prepackaged Software
INTC,Intel Corporation Common Stock,$33.36,-1.53,-4.385%,136409040000.00,United States,,44800132,Technology,Semiconductors
INTE,Integral Acquisition Corporation 1 Class A Common Stock,$9.90,-0.03,-0.302%,142312500.00,United States,2021,900,Industrials,Consumer Electronics/Appliances
INTEU,Integral Acquisition Corporation 1 Unit,$9.94,0.01,0.101%,0.00,United States,2021,1117,Industrials,Consumer Electronics/Appliances
INTEW,Integral Acquisition Corporation 1 Warrants,$0.11,-0.0168,-13.249%,0.00,United States,2021,19224,Industrials,Consumer Electronics/Appliances
INTG,Intergroup Corporation (The) Common Stock,$49.245,0.00,0.00%,110422802.00,United States,,4,Consumer Discretionary,Hotels/Resorts
INTR,Inter & Co. Inc. Class A Common Shares,$4.16,-0.05,-1.188%,10774967545.00,Brazil,,856767,,
INTU,Intuit Inc. Common Stock,$448.46,-17.39,-3.733%,126500262632.00,United States,1993,1777597,Technology,Computer Software: Prepackaged Software
INTZ,Intrusion Inc. Common Stock,$4.10,0.15,3.797%,79212160.00,United States,,28906,Technology,Security Systems Services
INVA,Innoviva Inc. Common Stock,$13.33,-0.19,-1.405%,929081831.00,United States,2004,914706,Health Care,Biotechnology: Pharmaceutical Preparations
INVE,Identiv Inc. Common Stock,$15.56,-0.47,-2.932%,347532647.00,United States,,63017,Technology,Computer peripheral equipment
INVO,INVO BioScience Inc. Common Stock,$0.9952,-0.0248,-2.431%,12038733.00,United States,,12921,Health Care,Medical/Dental Instruments
INVZ,Innoviz Technologies Ltd. Ordinary shares,$4.90,-0.17,-3.353%,660958883.00,Israel,,910314,Consumer Discretionary,Auto Parts:O.E.M.
INVZW,Innoviz Technologies Ltd. Warrant,$1.8399,0.0399,2.217%,0.00,Israel,,247,Consumer Discretionary,Auto Parts:O.E.M.
INZY,Inozyme Pharma Inc. Common Stock,$3.25,-0.23,-6.609%,130315497.00,United States,2020,63947,Health Care,Biotechnology: Pharmaceutical Preparations
IOAC,Innovative International Acquisition Corp. Class A Ordinary Shares,$10.09,-0.01,-0.099%,323989900.00,United States,2022,1400,,
IOACU,Innovative International Acquisition Corp. Unit,$10.10,0.07,0.698%,0.00,United States,2021,5700,,
IOACW,Innovative International Acquisition Corp. Warrants,$0.0625,-0.0001,-0.16%,0.00,United States,2022,11724,,
IOBT,IO Biotech Inc. Common Stock,$3.72,0.19,5.382%,107192793.00,Denmark,2021,34115,Health Care,Biotechnology: Pharmaceutical Preparations
IONM,Assure Holdings Corp. Common Stock,$1.00,-0.06,-5.66%,12919666.00,United States,,342850,Health Care,Assisted Living Services
IONR,ioneer Ltd American Depositary Shares,$17.80,-1.05,-5.57%,930628233.00,Australia,,17179,,
IONS,Ionis Pharmaceuticals Inc. Common Stock,$42.35,-1.60,-3.641%,6005139117.00,United States,,884399,Health Care,Biotechnology: Pharmaceutical Preparations
IOSP,Innospec Inc. Common Stock,$97.84,-2.92,-2.898%,2427916331.00,United States,,49220,Industrials,Industrial Specialties
IOVA,Iovance Biotherapeutics Inc. Common Stock,$11.00,-0.69,-5.902%,1728851531.00,United States,,2460670,Health Care,Biotechnology: Pharmaceutical Preparations
IPA,ImmunoPrecise Antibodies Ltd. Common Stock,$5.98,-0.17,-2.764%,140763005.00,Canada,,7241,,
IPAR,Inter Parfums Inc. Common Stock,$81.47,-1.60,-1.926%,2594490769.00,United States,,54217,Consumer Discretionary,Package Goods/Cosmetics
IPAX,Inflection Point Acquisition Corp. Class A Ordinary Share,$9.73,-0.01,-0.103%,401058438.00,United States,2021,3700,,
IPAXU,Inflection Point Acquisition Corp. Units,$9.80,-0.01,-0.102%,0.00,United States,2021,4505,,
IPAXW,Inflection Point Acquisition Corp. Warrants,$0.20,-0.05,-20.00%,0.00,United States,2021,1300,,
IPDN,Professional Diversity Network Inc. Common Stock,$0.7701,-0.0049,-0.632%,12588803.00,United States,2013,11364,Technology,EDP Services
IPGP,IPG Photonics Corporation Common Stock,$94.01,-4.02,-4.101%,4876546604.00,United States,2006,244612,Technology,Semiconductors
IPHA,Innate Pharma S.A. ADS,$2.70,0.00,0.00%,215334874.00,France,2019,5618,Health Care,Biotechnology: Pharmaceutical Preparations
IPSC,Century Therapeutics Inc. Common Stock,$10.37,-0.59,-5.383%,610277466.00,United States,2021,45762,Consumer Discretionary,Specialty Chemicals
IPVIU,InterPrivate IV InfraTech Partners Inc. Units,$9.85,0.01,0.102%,0.00,United States,2021,1320,Industrials,Consumer Electronics/Appliances
IPVIW,InterPrivate IV InfraTech Partners Inc. Warrant,$0.1001,-0.0099,-9.00%,0.00,United States,2021,600,Industrials,Consumer Electronics/Appliances
IPW,iPower Inc. Common Stock,$1.07,-0.03,-2.727%,31642449.00,United States,2021,48519,Consumer Discretionary,Catalog/Specialty Distribution
IPWR,Ideal Power Inc. Common Stock,$13.30,-0.175,-1.299%,78520500.00,United States,2013,15294,Industrials,Industrial Machinery/Components
IPX,IperionX Limited American Depositary Share,$7.21,0.02,0.278%,101580601.00,United States,,5390,,
IQ,iQIYI Inc. American Depositary Shares,$3.94,-0.03,-0.756%,3393423697.00,China,2018,17277703,Technology,Internet and Information Services
IQMD,Intelligent Medicine Acquisition Corp. Class A Common Stock,$10.06,0.04,0.399%,260302500.00,United States,2021,1669,Industrials,Consumer Electronics/Appliances
IQMDU,Intelligent Medicine Acquisition Corp. Unit,$10.035,-0.025,-0.249%,259655625.00,United States,2021,120,Industrials,Consumer Electronics/Appliances
IQMDW,Intelligent Medicine Acquisition Corp. Warrant,$0.0451,0.001,2.268%,0.00,United States,2021,650,Industrials,Consumer Electronics/Appliances
IRAA,Iris Acquisition Corp Class A Common Stock,$9.83,0.00,0.00%,,United States,2021,2,Industrials,Consumer Electronics/Appliances
IRAAU,Iris Acquisition Corp Units,$9.77,-0.06,-0.61%,,United States,2021,100,Industrials,Consumer Electronics/Appliances
IRAAW,Iris Acquisition Corp Warrant,$0.11,-0.0002,-0.181%,,United States,2021,10000,Industrials,Consumer Electronics/Appliances
IRBT,iRobot Corporation Common Stock,$58.83,-0.22,-0.373%,1595229397.00,United States,2005,1700136,,
IRDM,Iridium Communications Inc Common Stock,$45.11,-1.39,-2.989%,5773697287.00,United States,,427791,Consumer Discretionary,Telecommunications Equipment
IREN,Iris Energy Limited Ordinary Shares,$4.83,-0.17,-3.40%,265721634.00,Australia,2021,204904,,
IRIX,IRIDEX Corporation Common Stock,$2.61,-0.245,-8.581%,41465576.00,United States,1996,261079,Health Care,Biotechnology: Electromedical & Electrotherapeutic Apparatus
IRMD,iRadimed Corporation Common Stock,$32.51,-2.57,-7.326%,408350535.00,United States,2014,29250,Health Care,Medical/Dental Instruments
IROQ,IF Bancorp Inc. Common Stock,$19.00,-0.06,-0.315%,61894894.00,United States,2011,2602,Finance,Finance: Consumer Services
IRTC,iRhythm Technologies Inc. Common Stock,$147.72,-7.33,-4.728%,4400602583.00,United States,2016,192401,Health Care,Medical/Dental Instruments
IRWD,Ironwood Pharmaceuticals Inc. Class A Common Stock,$11.14,-0.34,-2.962%,1713753827.00,United States,2010,2520065,Health Care,Biotechnology: Pharmaceutical Preparations
ISAA,Iron Spark I Inc. Class A Common Stock,$9.88,-0.005,-0.051%,217763104.00,United States,2021,453,Industrials,Consumer Electronics/Appliances
ISEE,IVERIC bio Inc. Common Stock,$9.75,-0.64,-6.16%,1135087532.00,United States,2013,4103817,Health Care,Biotechnology: Pharmaceutical Preparations
ISIG,Insignia Systems Inc. Common Stock,$7.6945,-0.3455,-4.297%,13744655.00,United States,1991,9494,Consumer Discretionary,Advertising
ISLE,Isleworth Healthcare Acquisition Corporation Common stock,$10.01,-0.13,-1.282%,262174402.00,United States,2021,301893,Industrials,Consumer Electronics/Appliances
ISLEW,Isleworth Healthcare Acquisition Corporation Warrant,$0.0019,-0.0203,-91.441%,0.00,United States,2021,838083,Industrials,Consumer Electronics/Appliances
ISO,IsoPlexis Corporation Common Stock,$1.81,-0.20,-9.95%,70732898.00,United States,2021,90488,Health Care,Biotechnology: Electromedical & Electrotherapeutic Apparatus
ISPC,iSpecimen Inc. Common Stock,$2.23,-0.10,-4.292%,19778448.00,United States,2021,47991,Health Care,Precision Instruments
ISPO,Inspirato Incorporated Class A Common Stock,$2.96,-0.41,-12.166%,155230256.00,United States,2021,689544,Consumer Discretionary,Hotels/Resorts
ISPOW,Inspirato Incorporated Warrant,$0.45,0.00,0.00%,0.00,United States,2021,8162,Consumer Discretionary,Hotels/Resorts
ISRG,Intuitive Surgical Inc. Common Stock,$211.09,-13.93,-6.191%,75772129907.00,United States,2000,2474242,Health Care,Medical/Dental Instruments
ISSC,Innovative Solutions and Support Inc. Common Stock,$5.84,-0.35,-5.654%,100867125.00,United States,2000,29267,Industrials,Military/Government/Technical
ISTR,Investar Holding Corporation Common Stock,$21.90,-0.35,-1.573%,225506884.00,United States,2014,32360,Finance,Commercial Banks
ISUN,iSun Inc. Common Stock,$3.20,-0.16,-4.762%,44954214.00,United States,2016,165742,Technology,Semiconductors
ITAQ,Industrial Tech Acquisitions II Inc. Class A Common Stock,$9.95,-0.06,-0.599%,171637500.00,United States,2022,3843,Industrials,Consumer Electronics/Appliances
ITAQU,Industrial Tech Acquisitions II Inc. Unit,$9.98,-0.06,-0.598%,0.00,United States,2022,4100,Industrials,Consumer Electronics/Appliances
ITAQW,Industrial Tech Acquisitions II Inc. Warrants,$0.0901,-0.0399,-30.692%,0.00,United States,2022,1870,Industrials,Consumer Electronics/Appliances
ITCI,Intra-Cellular Therapies Inc. Common Stock,$49.70,0.39,0.791%,4687918356.00,United States,,682176,Health Care,Biotechnology: Pharmaceutical Preparations
ITI,Iteris Inc. Common Stock,$3.21,-0.03,-0.926%,136673502.00,United States,,89695,Telecommunications,Telecommunications Equipment
ITIC,Investors Title Company Common Stock,$162.00,-1.70,-1.038%,307355310.00,United States,,3567,Finance,Specialty Insurers
ITOS,iTeos Therapeutics Inc. Common Stock,$22.80,-1.10,-4.603%,810328051.00,United States,2020,350424,Consumer Discretionary,Specialty Chemicals
ITQ,Itiquira Acquisition Corp. Class A Ordinary Shares,$9.88,0.00,0.00%,284050000.00,United States,2021,202,Finance,Business Services
ITQRU,Itiquira Acquisition Corp. Unit,$9.89,0.00,0.00%,0.00,United States,2021,1704,Finance,Business Services
ITQRW,Itiquira Acquisition Corp. Warrant,$0.0737,0.0236,47.106%,0.00,United States,2021,117,Finance,Business Services
ITRI,Itron Inc. Common Stock,$48.88,-2.28,-4.457%,2202614674.00,United States,1993,260007,Industrials,Electrical Products
ITRM,Iterum Therapeutics plc Ordinary Share,$2.70,-0.12,-4.255%,495054229.00,Ireland,2018,123573,Health Care,Biotechnology: Pharmaceutical Preparations
ITRN,Ituran Location and Control Ltd. Ordinary Shares,$26.61,-0.65,-2.384%,545837545.00,Israel,2005,18197,Technology,Electronic Components
IVA,Inventiva S.A. American Depository Shares,$4.6599,0.00,0.00%,190466660.00,France,2020,775,Consumer Discretionary,Other Consumer Services
IVAC,Intevac Inc. Common Stock,$5.05,-0.01,-0.198%,126549147.00,United States,1995,28231,,
IVCA,Investcorp India Acquisition Corp. Class A Ordinary Share,$10.07,0.00,0.00%,325701563.00,Cayman Islands,2022,54,,
IVCAU,Investcorp India Acquisition Corp. Unit,$10.18,0.12,1.193%,0.00,Cayman Islands,2022,901,,
IVCAW,Investcorp India Acquisition Corp. Warrant,$0.1251,-0.0349,-21.813%,0.00,Cayman Islands,2022,158,,
IVCB,Investcorp Europe Acquisition Corp I Class A Ordinary Shares,$10.06,0.00,0.00%,433837500.00,Cayman Islands,2022,820,,
IVCP,Swiftmerge Acquisition Corp. Class A Ordinary Share,$9.91,0.00,0.00%,278718750.00,United States,2022,2,,
IVCPU,Swiftmerge Acquisition Corp. Unit,$9.93,-0.08,-0.799%,0.00,United States,2021,249,,
IVDA,Iveda Solutions Inc. Common Stock,$1.18,-0.01,-0.84%,13642743.00,United States,,20375,Technology,Security Systems Services
IXAQ,IX Acquisition Corp. Class A Ordinary Share,$9.91,-0.02,-0.201%,284912500.00,United Kingdom,2021,2006,,
IXAQU,IX Acquisition Corp. Unit,$9.89,0.00,0.00%,0.00,United Kingdom,2021,3071,,
IXAQW,IX Acquisition Corp. Warrant,$0.08,0.00,0.00%,0.00,United Kingdom,2021,503,,
IXHL,Incannex Healthcare Limited American Depositary Shares,$4.3136,0.0636,1.496%,221259042.00,Australia,,13185,,
IZEA,IZEA Worldwide Inc. Common Stock,$0.8967,-0.0233,-2.533%,55797560.00,United States,,79202,Consumer Discretionary,Advertising
JACK,Jack In The Box Inc. Common Stock,$87.12,-4.72,-5.139%,1833524035.00,United States,,252649,Consumer Discretionary,Restaurants
JAGX,Jaguar Health Inc. Common Stock,$0.2441,0.0098,4.183%,19006975.00,United States,2015,8457231,Health Care,Biotechnology: Pharmaceutical Preparations
JAKK,JAKKS Pacific Inc. Common Stock,$24.05,-1.34,-5.278%,230586734.00,United States,1996,189814,Consumer Discretionary,Recreational Games/Products/Toys
JAMF,Jamf Holding Corp. Common Stock,$24.68,-0.87,-3.405%,2957364789.00,United States,2020,294104,Technology,Computer Software: Prepackaged Software
JAN,JanOne Inc. Common Stock (NV),$2.92,-0.17,-5.502%,8256037.00,United States,,50406,Utilities,Environmental Services
JANX,Janux Therapeutics Inc. Common Stock,$11.41,-1.15,-9.156%,474991077.00,United States,2021,34614,Health Care,Biotechnology: Pharmaceutical Preparations
JAQC,Jupiter Acquisition Corporation Common stock,$9.74,0.00,0.00%,197698127.00,United States,2021,23,Industrials,Consumer Electronics/Appliances
JAQCU,Jupiter Acquisition Corporation Units,$9.74,-0.03,-0.307%,0.00,United States,2021,3392,Industrials,Consumer Electronics/Appliances
JAQCW,Jupiter Acquisition Corporation Warrants,$0.11,0.00,0.00%,0.00,United States,2021,695,Industrials,Consumer Electronics/Appliances
JAZZ,Jazz Pharmaceuticals plc Common Stock (Ireland),$155.87,-4.64,-2.891%,9732919957.00,Ireland,2007,269747,Health Care,Biotechnology: Pharmaceutical Preparations
JBHT,J.B. Hunt Transport Services Inc. Common Stock,$182.59,-6.77,-3.575%,18955215670.00,United States,,707844,Industrials,Trucking Freight/Courier Services
JBLU,JetBlue Airways Corporation Common Stock,$8.03,-0.35,-4.177%,2575935895.00,United States,2002,8955913,Consumer Discretionary,Air Freight/Delivery Services
JBSS,John B. Sanfilippo & Son Inc. Common Stock,$82.38,0.36,0.439%,949507431.00,United States,1991,116997,Consumer Staples,Specialty Foods
JCIC,Jack Creek Investment Corp. Class A Ordinary Shares,$9.88,0.00,0.00%,426075000.00,United States,2021,922,Finance,Business Services
JCICU,Jack Creek Investment Corp. Units,$9.965,0.005,0.05%,0.00,United States,2021,2100,Finance,Business Services
JCICW,Jack Creek Investment Corp. Warrants,$0.21,-0.0011,-0.521%,0.00,United States,2021,13800,Finance,Business Services
JCSE,JE Cleantech Holdings Limited Ordinary Shares,$1.72,-0.21,-10.881%,25834400.00,Singapore,2022,406311,,
JCTCF,Jewett-Cameron Trading Company Common Shares,$6.5125,0.0175,0.269%,22747134.00,United States,,573,,
JD,JD.com Inc. American Depositary Shares,$63.46,-1.45,-2.234%,99108502315.00,China,2014,14633818,Consumer Discretionary,Catalog/Specialty Distribution
JFBR,Jeffs' Brands Ltd Ordinary Shares,$2.68,-1.47,-35.422%,,Israel,,4099969,,
JFBRW,Jeffs' Brands Ltd Warrant,$0.328,0.318,3180.00%,,Israel,,329188,,
JFIN,Jiayin Group Inc. American Depositary Shares,$2.62,0.08,3.15%,141545500.00,China,2019,38712,Finance,Finance: Consumer Services
JFU,9F Inc. American Depositary Shares,$0.3966,-0.0034,-0.85%,92101093.00,China,2019,1008830,Finance,Finance: Consumer Services
JG,Aurora Mobile Limited American Depositary Shares,$0.8889,-0.001,-0.112%,105494056.00,China,2018,64943,Technology,EDP Services
JGGC,Jaguar Global Growth Corporation I Class A Ordinary Shares,$9.94,0.00,0.00%,304826670.00,United States,2022,35000,,
JGGCR,Jaguar Global Growth Corporation I Right,$0.12,0.00,0.00%,0.00,United States,2022,64800,,
JGGCU,Jaguar Global Growth Corporation I Unit,$10.10,0.00,0.00%,0.00,United States,2022,25098,,
JGGCW,Jaguar Global Growth Corporation I Warrant,$0.1005,-0.0095,-8.636%,0.00,United States,2022,5000,,
JJSF,J & J Snack Foods Corp. Common Stock,$154.43,0.04,0.026%,2961182896.00,United States,1986,61542,Consumer Staples,Specialty Foods
JKHY,Jack Henry & Associates Inc. Common Stock,$197.47,-2.71,-1.354%,14388021028.00,United States,1985,326933,Technology,Retail: Computer Software & Peripheral Equipment
JMAC,Maxpro Capital Acquisition Corp. Class A Common Stock,$10.08,0.00,0.00%,135349452.00,Taiwan,2021,2,Industrials,Consumer Electronics/Appliances
JMSB,John Marshall Bancorp Inc. Common Stock,$25.87,-1.16,-4.292%,362867857.00,United States,,18288,Finance,Major Banks
JNCE,Jounce Therapeutics Inc. Common Stock,$4.15,-0.20,-4.598%,214448494.00,United States,2017,136720,Health Care,Biotechnology: Pharmaceutical Preparations
JOAN,JOANN Inc. Common Stock,$8.05,-0.54,-6.286%,327372844.00,United States,2021,57584,Consumer Discretionary,Department/Specialty Retail Stores
JOFF,JOFF Fintech Acquisition Corp. Class A Common Stock,$9.85,0.00,0.00%,509737500.00,United States,2021,1471,Industrials,Consumer Electronics/Appliances
JOFFU,JOFF Fintech Acquisition Corp. Unit,$9.87,0.00,0.00%,0.00,United States,2021,1720,Industrials,Consumer Electronics/Appliances
JOFFW,JOFF Fintech Acquisition Corp. Warrant,$0.0948,0.0048,5.333%,0.00,United States,2021,3198,Industrials,Consumer Electronics/Appliances
JOUT,Johnson Outdoors Inc. Class A Common Stock,$64.50,-4.08,-5.949%,655835097.00,United States,,26054,Consumer Discretionary,Recreational Games/Products/Toys
JRSH,Jerash Holdings (US) Inc. Common Stock,$5.30,-0.0315,-0.591%,65371885.00,United States,2018,3861,Consumer Discretionary,Industrial Specialties
JRVR,James River Group Holdings Ltd. Common Shares,$24.64,-0.22,-0.885%,922774505.00,Bermuda,2014,85836,Finance,Property-Casualty Insurers
JSM,Navient Corporation 6% Senior Notes due December 15 2043,$22.07,-0.455,-2.02%,0.00,United States,,5879,Finance,Finance: Consumer Services
JSPR,Jasper Therapeutics Inc. Common Stock,$2.07,0.15,7.813%,78403910.00,United States,2020,97407,Health Care,Biotechnology: Pharmaceutical Preparations
JSPRW,Japer Therapeutics Inc. Warrants,$0.0875,-0.0024,-2.67%,0.00,United States,2020,3802,Health Care,Biotechnology: Pharmaceutical Preparations
JUGG,Jaws Juggernaut Acquisition Corporation Class A Ordinary Share,$9.77,0.00,0.00%,337065000.00,United States,2021,275,,
JUGGU,Jaws Juggernaut Acquisition Corporation Unit,$9.82,-0.02,-0.203%,0.00,United States,2021,571,,
JUGGW,Jaws Juggernaut Acquisition Corporation Warrant,$0.24,0.00,0.00%,0.00,United States,2021,50,,
JUPW,Jupiter Wellness Inc. Common Stock,$0.7249,0.0249,3.557%,16057643.00,United States,2020,172218,Health Care,Biotechnology: Pharmaceutical Preparations
JUPWW,Jupiter Wellness Inc. Warrant,$0.28,0.00,0.00%,0.00,United States,2020,94,Health Care,Biotechnology: Pharmaceutical Preparations
JVA,Coffee Holding Co. Inc. Common Stock,$2.8001,-0.0599,-2.094%,15984648.00,United States,2005,13435,Consumer Staples,Specialty Foods
JWAC,Jupiter Wellness Acquisition Corp. Class A Common Stock,$10.02,0.00,0.00%,181913100.00,United States,2022,51440,Industrials,Consumer Electronics/Appliances
JWEL,Jowell Global Ltd. Ordinary Shares,$1.23,0.01,0.82%,38652707.00,China,2021,102903,Consumer Discretionary,Other Consumer Services
JYAC,Jiya Acquisition Corp. Class A Common Stock,$9.93,0.00,0.00%,133529614.00,United States,2020,2397,Industrials,Consumer Electronics/Appliances
JYNT,The Joint Corp. Common Stock,$19.00,-1.62,-7.856%,274765308.00,United States,2014,115601,,
JZ,Jianzhi Education Technology Group Company Limited American Depositary Shares,$18.75,13.75,275.00%,,China,,5119479,,
JZXN,Jiuzi Holdings Inc. Ordinary Shares,$0.7649,0.0328,4.48%,16389393.00,China,2021,126504,Consumer Discretionary,Retail-Auto Dealers and Gas Stations
KACLU,Kairous Acquisition Corp. Limited Unit,$10.1166,0.0066,0.065%,0.00,Malaysia,2021,3534,,
KAII,Kismet Acquisition Two Corp. Class A Ordinary Shares,$9.89,0.00,0.00%,289282500.00,United States,2021,6987,Finance,Business Services
KAIIU,Kismet Acquisition Two Corp. Unit,$9.90,0.02,0.202%,0.00,United States,2021,4374,Finance,Business Services
KAIIW,Kismet Acquisition Two Corp. Warrant,$0.06,0.00,0.00%,0.00,United States,2021,38,Finance,Business Services
KAIR,Kairos Acquisition Corp. Class A Ordinary Shares,$9.92,0.01,0.101%,342240000.00,United States,2021,2104,Finance,Business Services
KAIRU,Kairos Acquisition Corp. Unit,$9.93,-0.005,-0.05%,0.00,United States,2021,300,Finance,Business Services
KAIRW,Kairos Acquisition Corp. Warrant,$0.1031,0.00,0.00%,0.00,United States,2021,600,Finance,Business Services
KAL,Kalera Public Limited Company Ordinary Shares,$1.82,-0.14,-7.143%,43093647.00,Ireland,,87589,,
KALA,Kala Pharmaceuticals Inc. Common Stock,$0.2928,-0.0244,-7.692%,16414328.00,United States,2017,318464,Health Care,Biotechnology: Pharmaceutical Preparations
KALU,Kaiser Aluminum Corporation Common Stock,$76.17,-2.98,-3.765%,1211432131.00,United States,,58876,Industrials,Aluminum
KALV,KalVista Pharmaceuticals Inc. Common Stock,$16.27,-0.31,-1.87%,399768087.00,United Kingdom,2015,271384,Health Care,Biotechnology: Pharmaceutical Preparations
KARO,Karooooo Ltd. Ordinary Shares,$25.755,-0.135,-0.521%,797145735.00,Singapore,2021,2307,Technology,Computer Software: Prepackaged Software
