Symbol,Name,Last Sale,Net Change,% Change,Market Cap,Country,IPO Year,Volume,Sector,Industry
CSQ,Calamos Strategic Total Return Common Stock,$14.92,-0.40,-2.611%,2355494179.00,United States,2004,183311,Finance,Finance Companies
CSSE,Chicken Soup for the Soul Entertainment Inc. Class A Common Stock,$9.01,-0.67,-6.921%,113966571.00,United States,2017,136490,Consumer Discretionary,Movies/Entertainment
CSSEL,Chicken Soup for the Soul Entertainment Inc. Warrant,$0.124,0.0049,4.114%,,United States,,147965,Consumer Discretionary,Movies/Entertainment
CSSEN,Chicken Soup for the Soul Entertainment Inc. 9.50% Notes due 2025,$25.26,-0.01,-0.04%,0.00,United States,,1302,Consumer Discretionary,Movies/Entertainment
CSSEP,Chicken Soup for the Soul Entertainment Inc. 9.75% Series A Cumulative Redeemable Perpetual Preferred Stock,$24.12,0.0851,0.354%,0.00,United States,,13648,Consumer Discretionary,Movies/Entertainment
CSTE,Caesarstone Ltd. Ordinary Shares,$10.40,-0.19,-1.794%,358550348.00,Israel,2012,91646,Industrials,Building Materials
CSTL,Castle Biosciences Inc. Common Stock,$30.94,-1.72,-5.266%,812512741.00,United States,2019,218817,Health Care,Medical Specialities
CSTR,CapStar Financial Holdings Inc. Common Stock,$20.66,-0.31,-1.478%,455885068.00,United States,2016,33164,Finance,Major Banks
CSWC,Capital Southwest Corporation Common Stock,$20.36,-0.22,-1.069%,521104325.00,United States,,125344,Finance,Finance/Investors Services
CSWI,CSW Industrials Inc. Common Stock,$131.45,-3.52,-2.608%,2031516503.00,United States,,43809,Industrials,Home Furnishings
CSX,CSX Corporation Common Stock,$32.63,-1.35,-3.973%,69868698268.00,United States,,13511159,Industrials,Railroads
CTAQ,Carney Technology Acquisition Corp. II Class A Common Stock,$9.92,0.01,0.101%,508028000.00,United States,2021,13447,Industrials,Consumer Electronics/Appliances
CTAQU,Carney Technology Acquisition Corp. II Units,$9.93,0.00,0.00%,0.00,United States,2020,1500,Industrials,Consumer Electronics/Appliances
CTAQW,Carney Technology Acquisition Corp. II Warrant,$0.10,0.00,0.00%,0.00,United States,2021,4,Industrials,Consumer Electronics/Appliances
CTAS,Cintas Corporation Common Stock,$420.02,-13.31,-3.072%,42720744524.00,United States,1983,503531,Consumer Discretionary,Business Services
CTBI,Community Trust Bancorp Inc. Common Stock,$43.09,-0.54,-1.238%,771103349.00,United States,,25830,Finance,Major Banks
CTG,Computer Task Group Inc. Common Stock,$7.80,0.03,0.386%,120254191.00,United States,,12052,Technology,EDP Services
CTHR,Charles & Colvard Ltd Common Stock,$1.29,-0.01,-0.769%,39588547.00,United States,1997,27662,Consumer Discretionary,Consumer Specialties
CTIB,Yunhong CTI Ltd. Common Stock,$0.8951,-0.0052,-0.578%,5291607.00,United States,1997,15701,Miscellaneous,Diversified Commercial Services
CTIC,CTI BioPharma Corp. (DE) Common Stock,$6.41,-0.21,-3.172%,698477733.00,United States,1997,2997547,Health Care,Biotechnology: Pharmaceutical Preparations
CTKB,Cytek Biosciences Inc. Common Stock,$12.91,-0.67,-4.934%,1733982573.00,United States,2021,282910,Health Care,Biotechnology: Electromedical & Electrotherapeutic Apparatus
CTLP,Cantaloupe Inc. Common Stock,$5.69,-0.34,-5.638%,404621636.00,United States,,91720,Technology,EDP Services
CTMX,CytomX Therapeutics Inc. Common Stock,$1.53,-0.12,-7.273%,100059483.00,United States,2015,496806,Health Care,Biotechnology: Pharmaceutical Preparations
CTRM,Castor Maritime Inc. Common Shares,$1.44,-0.11,-7.097%,136238527.00,Cyprus,,1162590,Consumer Discretionary,Marine Transportation
CTRN,Citi Trends Inc. Common Stock,$22.84,-0.52,-2.226%,191750982.00,United States,2005,307687,,
CTSH,Cognizant Technology Solutions Corporation Class A Common Stock,$64.70,-2.33,-3.476%,33719947319.00,United States,1998,2350943,Technology,EDP Services
CTSO,Cytosorbents Corporation Common Stock,$1.98,-0.09,-4.348%,86252996.00,United States,,39996,Health Care,Medical/Dental Instruments
CTXR,Citius Pharmaceuticals Inc. Common Stock,$1.22,-0.06,-4.688%,178278149.00,United States,,336322,Health Care,Biotechnology: Pharmaceutical Preparations
CTXS,Citrix Systems Inc. Common Stock,$102.45,-0.25,-0.243%,12968113419.00,United States,1995,623112,Technology,Computer Software: Prepackaged Software
CUBA,Herzfeld Caribbean Basin Fund Inc. (The) Common Stock,$4.42,-0.11,-2.428%,26411520.00,United States,,13486,Finance,Investment Managers
CUE,Cue Biopharma Inc. Common Stock,$2.81,-0.15,-5.068%,99395865.00,United States,2018,196232,Health Care,Biotechnology: Pharmaceutical Preparations
CUEN,Cuentas Inc. Common Stock,$0.6852,-0.0022,-0.32%,10254491.00,United States,,67245,Technology,Computer Software: Prepackaged Software
CUENW,Cuentas Inc. Warrant,$0.1985,0.0085,4.474%,0.00,United States,,400,Technology,Computer Software: Prepackaged Software
CULL,Cullman Bancorp Inc. Common Stock,$11.35,0.09,0.799%,84056886.00,United States,2021,9549,Finance,Savings Institutions
CURI,CuriosityStream Inc. Class A Common Stock,$1.75,-0.05,-2.778%,92356093.00,United States,2020,107805,Industrials,Broadcasting
CURIW,CuriosityStream Inc. Warrant,$0.2601,0.035,15.549%,0.00,United States,2020,200,Industrials,Broadcasting
CUTR,Cutera Inc. Common Stock,$48.26,-5.78,-10.696%,876565153.00,United States,2004,529168,Health Care,Biotechnology: Electromedical & Electrotherapeutic Apparatus
CVAC,CureVac N.V. Ordinary Shares,$10.29,-1.12,-9.816%,1925472188.00,Germany,2020,454901,Health Care,Biotechnology: Pharmaceutical Preparations
CVBF,CVB Financial Corporation Common Stock,$26.96,-0.26,-0.955%,3775089610.00,United States,,431927,Finance,Major Banks
CVCO,Cavco Industries Inc. Common Stock When Issued,$247.94,-11.23,-4.333%,2204982983.00,United States,,42753,Consumer Discretionary,Homebuilding
CVCY,Central Valley Community Bancorp Common Stock,$17.77,-0.11,-0.615%,208213684.00,United States,,17283,Finance,Major Banks
CVET,Covetrus Inc. Common Stock,$20.84,-0.04,-0.192%,2907564206.00,United States,,620265,Health Care,Other Pharmaceuticals
CVGI,Commercial Vehicle Group Inc. Common Stock,$6.87,-0.28,-3.916%,226338931.00,United States,2004,132043,Consumer Discretionary,Auto Parts:O.E.M.
CVGW,Calavo Growers Inc. Common Stock,$42.64,-1.01,-2.314%,756524850.00,United States,,45126,Consumer Discretionary,Specialty Foods
CVLG,Covenant Logistics Group Inc. Class A Common Stock,$31.85,-1.19,-3.602%,496791140.00,United States,,83328,Industrials,Trucking Freight/Courier Services
CVLT,Commvault Systems Inc. Common Stock,$55.52,-2.11,-3.661%,2489289168.00,United States,2006,142482,Technology,Computer Software: Prepackaged Software
CVLY,Codorus Valley Bancorp Inc Common Stock,$20.57,0.30,1.48%,195993470.00,United States,,35432,Finance,Savings Institutions
CVRX,CVRx Inc. Common Stock,$7.56,-0.42,-5.263%,154981338.00,United States,2021,14478,Health Care,Biotechnology: Electromedical & Electrotherapeutic Apparatus
CVT,Cvent Holding Corp. Common Stock,$5.39,-0.32,-5.604%,2594338279.00,United States,2020,520295,Technology,Computer Software: Prepackaged Software
CVV,CVD Equipment Corporation Common Stock,$5.60,-0.40,-6.667%,37682053.00,United States,,16291,Technology,Industrial Machinery/Components
CWBC,Community West Bancshares Common Stock,$14.1001,-0.0849,-0.599%,122428052.00,United States,,1464,Finance,Major Banks
CWBR,CohBar Inc. Common Stock,$0.165,-0.0028,-1.669%,14351978.00,United States,,374037,Health Care,Biotechnology: In Vitro & In Vivo Diagnostic Substances
CWCO,Consolidated Water Co. Ltd. Ordinary Shares,$16.33,-0.07,-0.427%,249612591.00,Cayman Islands,,81907,Utilities,Water Supply
CWST,Casella Waste Systems Inc. Class A Common Stock,$82.14,-2.30,-2.724%,4241604297.00,United States,1997,115865,Utilities,Environmental Services
CXDO,Crexendo Inc. Common Stock,$2.88,-0.12,-4.00%,64584596.00,United States,,6455,Consumer Discretionary,Telecommunications Equipment
CYAD,Celyad Oncology SA American Depositary Shares,$1.99,0.0358,1.832%,44961972.00,Belgium,2015,21826,Health Care,Biotechnology: Pharmaceutical Preparations
CYAN,Cyanotech Corporation Common Stock,$2.51,-0.05,-1.953%,15571144.00,United States,,4545,Consumer Staples,Farming/Seeds/Milling
CYBE,CyberOptics Corporation Common Stock,$53.37,-0.12,-0.224%,395134562.00,United States,1987,131167,Technology,Electronic Components
CYBR,CyberArk Software Ltd. Ordinary Shares,$148.25,-5.55,-3.609%,6036195774.00,Israel,2014,238584,Technology,Computer Software: Prepackaged Software
CYCC,Cyclacel Pharmaceuticals Inc. Common Stock,$1.67,0.03,1.829%,16691632.00,United States,,351587,Health Care,Biotechnology: Pharmaceutical Preparations
CYCCP,Cyclacel Pharmaceuticals Inc. 6% Convertible Preferred Stock,$6.98,0.00,0.00%,0.00,United States,,2,Health Care,Biotechnology: Pharmaceutical Preparations
CYCN,Cyclerion Therapeutics Inc. Common Stock,$0.75,-0.0198,-2.572%,32586270.00,United States,,73095,Health Care,Biotechnology: Pharmaceutical Preparations
CYN,Cyngn Inc. Common Stock,$1.38,-0.10,-6.757%,46333961.00,United States,2021,303831,Technology,EDP Services
CYRN,CYREN Ltd. Ordinary Shares,$1.57,-0.03,-1.875%,8373695.00,United States,,231310,Technology,Computer Software: Prepackaged Software
CYRX,CryoPort Inc. Common Stock,$37.65,-2.26,-5.663%,1859021799.00,United States,,170693,,
CYT,Cyteir Therapeutics Inc. Common Stock,$2.24,-0.08,-3.448%,79316223.00,United States,2021,18056,Health Care,Biotechnology: Pharmaceutical Preparations
CYTH,Cyclo Therapeutics Inc. Common Stock,$2.24,0.01,0.448%,18853076.00,United States,,7523,Health Care,Biotechnology: Pharmaceutical Preparations
CYTK,Cytokinetics Incorporated Common Stock,$51.02,-1.23,-2.354%,4369975907.00,United States,2004,695971,Health Care,Biotechnology: Pharmaceutical Preparations
CYTO,Altamira Therapeutics Ltd. Common Shares 0.01 SF (Bermuda),$0.3999,-0.0102,-2.487%,6224148.00,Bermuda,2014,366202,Health Care,Biotechnology: Pharmaceutical Preparations
CYXT,Cyxtera Technologies Inc. Class A Common Stock,$6.78,-0.71,-9.479%,1210679867.00,United States,2020,731644,Technology,EDP Services
CZFS,Citizens Financial Services Inc. Common Stock,$81.90,-0.60,-0.727%,325861181.00,United States,,8259,Finance,Major Banks
CZNC,Citizens & Northern Corp Common Stock,$24.15,-0.54,-2.187%,376864010.00,United States,,9006,Finance,Major Banks
CZR,Caesars Entertainment Inc. Common Stock,$44.31,-2.54,-5.422%,9498563619.00,United States,,2335807,Consumer Discretionary,Hotels/Resorts
CZWI,Citizens Community Bancorp Inc. Common Stock,$13.50,0.17,1.275%,142172294.00,United States,2006,1492,Finance,Savings Institutions
DADA,Dada Nexus Limited American Depositary Shares,$7.20,0.02,0.279%,1873994126.00,China,2020,1495555,Consumer Discretionary,Department/Specialty Retail Stores
DAIO,Data I/O Corporation Common Stock,$3.33,-0.08,-2.346%,28718489.00,United States,1981,9710,Technology,Industrial Machinery/Components
DAKT,Daktronics Inc. Common Stock,$4.27,0.00,0.00%,192294493.00,United States,1994,77129,Industrials,Office Equipment/Supplies/Services
DALN,DallasNews Corporation Series A Common Stock,$7.88,0.13,1.677%,42177621.00,United States,,49085,Consumer Discretionary,Newspapers/Magazines
DALS,DA32 Life Science Tech Acquisition Corp. Class A Common Stock,$9.71,0.00,0.00%,249061500.00,United States,2021,11,Industrials,Consumer Electronics/Appliances
DAOO,Crypto 1 Acquisition Corp Class A Ordinary Shares,$10.00,0.01,0.10%,287500000.00,United States,2022,11747,,
DAOOU,Crypto 1 Acquisition Corp Unit,$10.00,0.01,0.10%,0.00,United States,2021,1206,,
DAOOW,Crypto 1 Acquisition Corp Warrants,$0.0798,0.0048,6.40%,0.00,United States,2022,4294,,
DARE,Dare Bioscience Inc. Common Stock,$1.11,-0.01,-0.893%,94029594.00,United States,2014,275865,Health Care,Biotechnology: Pharmaceutical Preparations
DATS,DatChat Inc. Common Stock,$1.12,-0.07,-5.882%,21949109.00,United States,2021,121533,Technology,Computer Software: Prepackaged Software
DATSW,DatChat Inc. Series A Warrant,$0.3998,0.0623,18.459%,0.00,United States,2021,228,Technology,Computer Software: Prepackaged Software
DAVE,Dave Inc. Class A Common Stock,$0.529,-0.0108,-2.001%,197744511.00,United States,,2021494,Technology,Retail: Computer Software & Peripheral Equipment
DAVEW,Dave Inc. Warrants,$0.09,-0.001,-1.099%,0.00,United States,,39570,Technology,Retail: Computer Software & Peripheral Equipment
DAWN,Day One Biopharmaceuticals Inc. Common Stock,$24.09,-0.66,-2.667%,1732358370.00,United States,2021,309469,Health Care,Biotechnology: Pharmaceutical Preparations
DBGI,Digital Brands Group Inc. Common Stock,$0.1513,-0.0071,-4.482%,7756454.00,United States,2021,1734556,Consumer Discretionary,Apparel
DBGIW,Digital Brands Group Inc. Warrant,$0.0689,0.0079,12.951%,0.00,United States,2021,4198,Consumer Discretionary,Apparel
DBTX,Decibel Therapeutics Inc. Common Stock,$4.36,0.01,0.23%,108845229.00,United States,2021,6073,Health Care,Biotechnology: Pharmaceutical Preparations
DBVT,DBV Technologies S.A. American Depositary Shares,$2.10,-0.11,-4.977%,394146358.00,France,2014,41291,Health Care,Biotechnology: Biological Products (No Diagnostic Substances)
DBX,Dropbox Inc. Class A Common Stock,$22.05,-0.86,-3.754%,8282068928.00,United States,2018,1760151,Technology,Computer Software: Prepackaged Software
DCBO,Docebo Inc. Common Shares,$29.39,-2.41,-7.579%,966449122.00,Canada,,135190,,
DCFC,Tritium DCFC Limited Ordinary Shares,$6.97,-0.29,-3.994%,1067067055.00,Australia,,233901,Technology,Electronic Components
DCFCW,Tritium DCFC Limited Warrant,$1.4899,-0.0296,-1.948%,0.00,Australia,,17967,Technology,Electronic Components
DCGO,DocGo Inc. Common Stock,$10.30,0.06,0.586%,1035506761.00,United States,2020,957197,Health Care,Managed Health Care
DCGOW,DocGo Inc. Warrants,$2.29,0.03,1.327%,0.00,United States,2020,88802,Health Care,Managed Health Care
DCOM,Dime Community Bancshares Inc. Common Stock,$32.49,-0.74,-2.227%,1275028398.00,United States,,67883,Finance,Savings Institutions
DCOMP,Dime Community Bancshares Inc. Fixed-Rate Non-Cumulative Perpetual Preferred Stock Series A,$21.86,0.01,0.046%,0.00,United States,,5483,Finance,Savings Institutions
DCPH,Deciphera Pharmaceuticals Inc. Common Stock,$14.85,-0.71,-4.563%,983315159.00,United States,2017,553937,Health Care,Biotechnology: Pharmaceutical Preparations
DCRD,Decarbonization Plus Acquisition Corporation IV Class A Ordinary Share,$9.98,0.00,0.00%,394521875.00,United States,2021,1001,,
DCRDU,Decarbonization Plus Acquisition Corporation IV Unit,$10.05,0.00,0.00%,0.00,United States,2021,5,,
DCRDW,Decarbonization Plus Acquisition Corporation IV Warrant,$0.1852,-0.0192,-9.393%,0.00,United States,2021,2002,,
DCT,Duck Creek Technologies Inc. Common Stock,$12.05,-0.39,-3.135%,1597482827.00,United States,2020,423640,Technology,Retail: Computer Software & Peripheral Equipment
DCTH,Delcath Systems Inc. Common Stock,$4.26,-0.14,-3.182%,33682661.00,United States,,8426,Health Care,Medical Specialities
DDI,DoubleDown Interactive Co. Ltd. American Depository Shares,$9.58,0.28,3.011%,474721955.00,South Korea,2021,1642,Technology,EDP Services
DDOG,Datadog Inc. Class A Common Stock,$106.73,-3.65,-3.307%,33621805074.00,United States,2019,3711137,Technology,EDP Services
DECAU,Denali Capital Acquisition Corp. Unit,$10.09,0.00,0.00%,0.00,United States,2022,20,,
DENN,Denny's Corporation Common Stock,$9.66,-0.46,-4.545%,596142286.00,United States,,451019,Consumer Discretionary,Restaurants
DERM,Journey Medical Corporation Common Stock,$3.21,0.00,0.00%,55955417.00,United States,2021,1725,Health Care,Biotechnology: Pharmaceutical Preparations
DFFN,Diffusion Pharmaceuticals Inc. Common Stock,$6.58,-0.2199,-3.234%,13413935.00,United States,,5835,Health Care,Biotechnology: Pharmaceutical Preparations
DFH,Dream Finders Homes Inc. Class A Common Stock,$11.83,-0.47,-3.821%,1097343891.00,United States,2021,235880,,
DGHI,Digihost Technology Inc. Common Subordinate Voting Shares,$0.97,-0.06,-5.825%,26855336.00,Canada,,68284,,
DGICA,Donegal Group Inc. Class A Common Stock,$14.92,-0.12,-0.798%,468778045.00,United States,,70085,Finance,Property-Casualty Insurers
DGICB,Donegal Group Inc. Class B Common Stock,$15.20,-0.01,-0.066%,477575488.00,United States,1986,649,Finance,Property-Casualty Insurers
DGII,Digi International Inc. Common Stock,$33.04,-1.63,-4.701%,1159200404.00,United States,1989,393104,Technology,Computer peripheral equipment
DGLY,Digital Ally Inc. Common Stock,$0.613,-0.0235,-3.692%,29698606.00,United States,,480477,Technology,Security Systems Services
DGNU,Dragoneer Growth Opportunities Corp. III Class A Ordinary Shares,$9.75,-0.03,-0.307%,524886453.00,United States,2021,34499,Finance,Business Services
DH,Definitive Healthcare Corp. Class A Common Stock,$20.21,-1.28,-5.956%,1973723515.00,United States,2021,286444,Technology,Computer Software: Prepackaged Software
DHACU,Digital Health Acquisition Corp. Unit,$10.20,-0.03,-0.293%,0.00,United States,2021,1000,Industrials,Consumer Electronics/Appliances
DHACW,Digital Health Acquisition Corp. Warrant,$0.1425,0.0145,11.328%,0.00,United States,2021,62805,Industrials,Consumer Electronics/Appliances
DHBC,DHB Capital Corp. Class A common stock,$9.81,-0.005,-0.051%,352546875.00,United States,2021,26930,Industrials,Consumer Electronics/Appliances
DHBCU,DHB Capital Corp. Unit,$9.83,0.00,0.00%,353265625.00,United States,2021,3598,Industrials,Consumer Electronics/Appliances
DHBCW,DHB Capital Corp. Warrant,$0.10,0.00,0.00%,0.00,United States,2021,17,Industrials,Consumer Electronics/Appliances
DHC,Diversified Healthcare Trust Common Shares of Beneficial Interest,$1.59,-0.08,-4.79%,379991391.00,United States,,2503033,Real Estate,Real Estate Investment Trusts
DHCA,DHC Acquisition Corp. Class A ordinary share,$9.88,0.03,0.305%,382171639.00,United States,2021,286739,Finance,Business Services
DHCAU,DHC Acquisition Corp. Unit,$9.86,0.01,0.102%,0.00,United States,2021,938,Finance,Business Services
DHCAW,DHC Acquisition Corp. Warrant,$0.2001,0.00,0.00%,0.00,United States,2021,4001,Finance,Business Services
DHCNI,Diversified Healthcare Trust 5.625% Senior Notes due 2042,$15.85,-0.39,-2.401%,0.00,United States,,7315,Real Estate,Real Estate Investment Trusts
DHCNL,Diversified Healthcare Trust 6.25% Senior Notes Due 2046,$16.86,-0.14,-0.824%,0.00,United States,,7258,Real Estate,Real Estate Investment Trusts
DHHC,DiamondHead Holdings Corp. Class A Common Stock,$9.855,-0.005,-0.051%,424996875.00,United States,2021,2959,Industrials,Consumer Electronics/Appliances
DHHCU,DiamondHead Holdings Corp. Unit,$9.88,0.02,0.203%,0.00,United States,2021,301,Industrials,Consumer Electronics/Appliances
DHIL,Diamond Hill Investment Group Inc. Class A Common Stock,$171.24,-4.34,-2.472%,542929605.00,United States,,14544,Finance,Investment Managers
DIBS,1stdibs.com Inc. Common Stock,$6.87,-0.34,-4.716%,261520661.00,United States,2021,89403,Miscellaneous,Diversified Commercial Services
DICE,DICE Therapeutics Inc. Common Stock,$17.48,-0.69,-3.797%,668247727.00,United States,2021,101363,Health Care,Biotechnology: Pharmaceutical Preparations
DILA,DILA Capital Acquisition Corp. Class A Common Stock,$9.905,0.00,0.00%,75074700.00,Mexico,2021,1,Industrials,Consumer Electronics/Appliances
DIOD,Diodes Incorporated Common Stock,$75.39,-4.35,-5.455%,3411191007.00,United States,,112708,Technology,Semiconductors
DISA,Disruptive Acquisition Corporation I Class A Ordinary Shares,$9.86,-0.01,-0.101%,338937500.00,United States,2021,1391,Finance,Business Services
DISAU,Disruptive Acquisition Corporation I Unit,$9.87,0.00,0.00%,0.00,United States,2021,4822,Finance,Business Services
DISH,DISH Network Corporation Class A Common Stock,$17.61,-0.95,-5.119%,9333240461.00,United States,1995,3076850,Consumer Discretionary,Telecommunications Equipment
DJCO,Daily Journal Corp. (S.C.) Common Stock,$264.40,-10.20,-3.714%,365069242.00,United States,,1771,Technology,Retail: Computer Software & Peripheral Equipment
DKDCA,Data Knights Acquisition Corp. Class A Common Stock,$10.34,0.01,0.097%,154688210.00,United Kingdom,2021,1005,Industrials,Consumer Electronics/Appliances
DKDCU,Data Knights Acquisition Corp. Unit,$10.42,-0.16,-1.512%,0.00,United Kingdom,2021,100,Industrials,Consumer Electronics/Appliances
DKNG,DraftKings Inc. Class A Common Stock,$16.53,-0.90,-5.164%,7229276682.00,United States,2019,16433286,Consumer Discretionary,Services-Misc. Amusement & Recreation
DLCA,Deep Lake Capital Acquisition Corp. Class A Ordinary Shares,$9.9101,0.0001,0.001%,256423838.00,United States,2021,3854,Finance,Business Services
DLCAU,Deep Lake Capital Acquisition Corp. Unit,$9.93,0.00,0.00%,0.00,United States,2021,200,Finance,Business Services
DLCAW,Deep Lake Capital Acquisition Corp. Warrant,$0.06,0.00,0.00%,0.00,United States,2021,286,Finance,Business Services
DLHC,DLH Holdings Corp.,$15.61,-1.44,-8.446%,199759422.00,United States,,22148,Consumer Discretionary,Business Services
DLO,DLocal Limited Class A Common Shares,$26.19,-1.50,-5.417%,7726794870.00,Uruguay,2021,1049488,,
DLPN,Dolphin Entertainment Inc. Common Stock,$3.98,0.01,0.252%,38016793.00,United States,,5878,Technology,Interactive Media
DLTH,Duluth Holdings Inc. Class B Common Stock,$8.99,-0.59,-6.159%,299903703.00,United States,2015,120089,Consumer Discretionary,Department/Specialty Retail Stores
DLTR,Dollar Tree Inc. Common Stock,$138.70,-10.31,-6.919%,31145922193.00,United States,1995,7135584,Consumer Discretionary,Department/Specialty Retail Stores
DMAC,DiaMedica Therapeutics Inc. Common Stock,$1.74,-0.11,-5.946%,46010937.00,United States,2018,14909,,
DMAQ,Deep Medicine Acquisition Corp. Class A Common Stock,$10.03,0.00,0.00%,164824996.00,United States,2021,785387,Industrials,Consumer Electronics/Appliances
DMLP,Dorchester Minerals L.P. Common Units Representing Limited Partnership Interests,$29.05,-0.30,-1.022%,1090966185.00,United States,,63917,Energy,Oil & Gas Production
DMRC,Digimarc Corporation Common Stock,$17.95,-0.67,-3.598%,357939532.00,United States,,78868,Technology,EDP Services
DMTK,DermTech Inc. Common Stock,$5.82,-0.34,-5.519%,174254507.00,United States,2017,231154,Health Care,Managed Health Care
DNAB,Social Capital Suvretta Holdings Corp. II Class A Ordinary Shares,$9.77,0.005,0.051%,311565300.00,United States,2021,144379,,
DNAD,Social Capital Suvretta Holdings Corp. IV Class A Ordinary Shares,$9.7701,0.0051,0.052%,311568489.00,United States,2021,10692,Health Care,Biotechnology: Pharmaceutical Preparations
DNAY,Codex DNA Inc. Common Stock,$1.97,0.01,0.51%,57914972.00,United States,2021,225641,Health Care,Medical Specialities
DNLI,Denali Therapeutics Inc. Common Stock,$29.34,-1.91,-6.112%,3605700014.00,United States,2017,724536,Health Care,Biotechnology: Biological Products (No Diagnostic Substances)
DNUT,Krispy Kreme Inc. Common Stock,$11.94,-0.30,-2.451%,1997520473.00,United States,2021,848112,Consumer Discretionary,Specialty Foods
DOCU,DocuSign Inc. Common Stock,$58.02,-3.92,-6.329%,11600750880.00,United States,2018,4512180,Technology,EDP Services
DOGZ,Dogness (International) Corporation Class A Common Stock,$1.43,-0.08,-5.298%,56162190.00,China,2017,201827,Consumer Discretionary,Miscellaneous manufacturing industries
DOMO,Domo Inc. Class B Common Stock,$20.69,-7.98,-27.834%,697837410.00,United States,2018,4325789,Technology,Computer Software: Prepackaged Software
DOOO,BRP Inc. (Recreational Products) Common Subordinate Voting Shares,$72.79,-5.27,-6.751%,5727454290.00,Canada,,49326,,
DORM,Dorman Products Inc. Common Stock,$94.56,-3.34,-3.412%,2973743116.00,United States,,115625,Consumer Discretionary,Auto Parts:O.E.M.
DOX,Amdocs Limited Ordinary Shares,$86.33,-1.62,-1.842%,10604777200.00,Guernsey,,287125,Technology,EDP Services
DOYU,DouYu International Holdings Limited ADS,$1.28,-0.03,-2.29%,406379315.00,China,2019,1686030,Technology,Computer Software: Programming Data Processing
DPCS,DP Cap Acquisition Corp I Class A Ordinary Shares,$10.03,0.00,0.00%,288362500.00,United States,2021,11,,
DPRO,Draganfly Inc. Common Shares,$0.90,-0.02,-2.174%,29888685.00,Canada,,67980,Consumer Discretionary,Electronic Components
DRAY,Macondray Capital Acquisition Corp. I Class A Ordinary Shares,$9.995,0.00,0.00%,359195313.00,United States,2021,202,,
DRAYU,Macondray Capital Acquisition Corp. I Unit,$10.16,0.00,0.00%,0.00,United States,2021,30,,
DRAYW,Macondray Capital Acquisition Corp. I Warrant,$0.1028,-0.0972,-48.60%,0.00,United States,2021,4107,,
DRCT,Direct Digital Holdings Inc. Class A Common Stock,$3.13,-0.06,-1.881%,44377140.00,United States,2022,48650,Consumer Discretionary,Advertising
DRCTW,Direct Digital Holdings Inc. Warrant,$0.2501,0.00,0.00%,0.00,United States,2022,77,Consumer Discretionary,Advertising
DRIO,DarioHealth Corp. Common Stock,$4.87,-0.31,-5.985%,111328414.00,Israel,,195504,Health Care,Medical/Dental Instruments
DRMA,Dermata Therapeutics Inc. Common Stock,$0.6373,-0.0727,-10.239%,5880503.00,United States,2021,318099,Health Care,Biotechnology: Pharmaceutical Preparations
DRMAW,Dermata Therapeutics Inc. Warrant,$0.062,-0.038,-38.00%,0.00,United States,2021,19373,Health Care,Biotechnology: Pharmaceutical Preparations
DRRX,DURECT Corporation Common Stock,$0.8674,0.0167,1.963%,197562510.00,United States,2000,229722,Health Care,Biotechnology: Pharmaceutical Preparations
DRTS,Alpha Tau Medical Ltd. Ordinary Shares,$9.58,0.16,1.699%,656047185.00,Israel,,28080,Health Care,Biotechnology: Pharmaceutical Preparations
DRTSW,Alpha Tau Medical Ltd. Warrant,$0.65,-0.01,-1.515%,0.00,Israel,,9926,Finance,Business Services
DRTT,DIRTT Environmental Solutions Ltd. Common Shares,$0.6627,-0.0287,-4.151%,56904240.00,Canada,,26016,,
DRUG,Bright Minds Biosciences Inc. Common Stock,$2.55,-0.34,-11.765%,30273246.00,Canada,,106156178,,
DRVN,Driven Brands Holdings Inc. Common Stock,$31.47,-1.13,-3.466%,5271461686.00,United States,2021,403882,,
DSEY,Diversey Holdings Ltd. Ordinary Shares,$6.61,-0.30,-4.342%,2142900778.00,United States,2021,616271,Consumer Discretionary,Specialty Chemicals
DSGN,Design Therapeutics Inc. Common Stock,$20.27,-1.62,-7.401%,1130710221.00,United States,2021,156544,Health Care,Biotechnology: Pharmaceutical Preparations
